2018-09-29 20:40,的小猴子又一次为我大厦门地铁工作人员点赞之前掉了个绑头发的橡皮筋工作人员追我到电梯口送给我今天公司博饼小有收获过完安检拿不动了工作人员帮忙送到乘车处太开心太开心太开心太开心太开心太开心感谢厦门地铁工作人员热心帮忙鼓掌鼓掌鼓掌鼓掌鼓掌鼓掌鼓掌鼓掌厦门地铁厦门地铁厦门身边事厦门身边事厦门地铁新闻厦门地铁新闻
2018-09-29 18:42,#地铁正能量#,厦门地铁地铁正能量厦门地铁及时救助受伤市民月日莲花路口站工作人员发现车站附近路边有市民受伤倒地情况危急车站工作人员立即拨打急救电话并携带医药箱赶往现场对伤者先期止血和包扎安抚伤者及家属直到赶到将伤者送往医院我们用地铁人的社会责任感温暖你的心点赞心心
2018-09-27 17:33,#地铁正能量#,厦门地铁地铁正能量刚刚在城市交通发布新媒体联盟成立仪式上国内首个地铁行业微博话题矩阵地铁正能量建立启动地铁行业官方微博齐齐集结聚焦正能量协同资源密集传播讲好打动人心的地铁故事把温暖传递的更远让正能量更能深入人心
2018-09-27 14:07,#真诚八年，感恩相伴#,成都地铁运营真诚八年感恩相伴年分钟风雨无阻未来余座地铁站加速成网成都地铁生活一脉
2018-09-27 11:47,#星火计划#,厦门地铁星火计划祝成都地铁周年生日快乐成都地铁成都地铁成都地铁运营成都地铁运营
2018-09-26 11:45,厦门地铁厦门地铁厦门地铁招贤纳士厦门地铁运营总部关键岗位广发英雄帖钢铁侠钢铁侠有意者请于年月日前至厦门地铁官网网页链接网页链接招贤纳才岗位应聘社会招聘板块进行简历投递憧憬憧憬阅读长文查看岗位详情招贤纳士厦门地铁运营总部关键岗位广发英雄帖招贤纳士厦门地铁运营总部关键岗位广发英雄帖
2018-09-26 11:36,#厦门地铁建设动态#,厦门地铁厦门地铁建设动态厦门地铁出行提示厦门地铁火炬园号线换乘站爆破作业期间道路交通临时限制的通知因厦门地铁号线火炬园号线换乘站爆破作业需要将对爆破作业点周边道路米范围采取临时道路交通限制措施禁止机动车非机动车及行人通行每次交通限制时长约分钟计划爆破作业时间从展开全文
2018-09-25 20:37,一纸荒芜难描少年眉间伤厦门地铁厦门地铁跟家人来中山公园站家里老人腿脚不方便坐轮椅感谢中山公园地铁站的工作人员帮我们过安检然后帮老人家带下去坐车感恩感恩太开心太开心太开心太开心厦门中山公园厦门中山公园
2018-09-25 15:25,#厦门地铁最强大脑#,厦门地铁每天地铁结束运营后都会进行相关施工养护例如线路巡检厦门地铁最强大脑第六章施工组织一将告诉您在施工进行前控制中心如何进行施工组织安排并不简单并不简单
2018-09-24 11:10,彪彪厦门地铁的小哥哥好可爱过安检还会给说中秋快乐哦厦门湖里区厦门湖里区
2018-09-24 10:55,#中秋佳节#,致敬那些中秋佳节中最别样的风景心心今天是中秋佳节五仁月饼五仁月饼祝我铁坚守一线的工作者们中秋节快乐五仁月饼五仁月饼
2018-09-23 21:30,#我在岗位上#,厦门警方在线我在岗位上暖心一刻薄薄雨衣浓浓警民情突降的大雨让地铁官任站号出入口滞留大量乘客值班民警魏尚奎在巡站及时发现这一情况立即问车站通报情况协调车控室广播通知乘客到客服中心领取一次性雨衣并与辅警一起将部分雨衣送到滞留人群手中乘客纷纷感谢警方这一及时帮助滞留的乘客很展开全文
2018-09-22 15:03,厦门地铁世界无车日厦门地铁邀您绿色出行月日世界无车日让我们停下爱车迈开步伐乘坐地铁公交绿色出行欣赏沿途的风景展开全文
2018-09-21 18:43,#今日贴纸打卡#,傻豆不柔第一次坐地铁的我感到无比兴奋嘻嘻嘻嘻嘻嘻嘻嘻嘻嘻嘻嘻回家又多了一条线路鼓掌鼓掌鼓掌鼓掌鼓掌鼓掌再转巨快啊啊啊啊啊啊哈哈哈哈哈哈哈哈哈哈哈哈今日贴纸打卡厦门地铁
2018-09-20 16:48,#厦门地铁建设动态#,厦门地铁厦门地铁建设动态厦门地铁出行提示因厦门地铁号线华荣路站火炬园站区间围挡爆破作业需要将对爆破作业点周边道路米范围采取临时道路交通限制措施禁止机动车非机动车及行人通行每次交通限制时长约分钟爆破作业时间年月日至年月日
2018-09-20 16:46,#厦门地铁建设动态#,厦门地铁厦门地铁建设动态厦门地铁出行提示因厦门地铁号线土建施工火炬园号线换乘站桩基和基坑石方爆破作业需要将对爆破作业点周边道路米范围采取临时道路交通限制措施禁止机动车非机动车及行人通行每次交通限制时长约分钟计划爆破作业时间从年月日至年月日
2018-09-20 15:11,#厦门地铁建设动态#,厦门地铁厦门地铁建设动态地铁号线信号系统工程今日启动今日上午时地铁号线东孚车辆段第一架信号机安装到位地铁号线信号系统正式进入现场施工阶段
2018-09-19 09:55,厦门的地铁真棒干净宽敞还有海景鼓掌鼓掌厦门地铁厦门地铁厦门厦门
2018-09-18 15:00,#厦门地铁最强大脑#,厦门地铁台风是一种极具破坏力的灾害天气对地铁的运行安全有非常大的影响据统计厦门一年大约要经历次台风厦门地铁在台风来临时有一系列应急处置措施本期厦门地铁最强大脑向您介绍控制中心如何采用应急处置措施保障台风天气下的地铁运行安全
2018-09-18 11:52,厦门地铁明天厦门地铁纪念票卡正式发售文创新品上线坏笑坏笑坏笑坏笑坏笑坏笑购买地点厦门地铁号线厦门北站乌石浦站中山公园站客服中心若您已有在厦门地铁客服中心登记预购纪念票卡我们将预留您预定的数量并电话通知您明天厦门地铁纪念票卡正式发售文创新品上明天厦门地铁纪念票卡正式发售文创新品上
2018-09-18 09:41,#牢记九一八#,厦门地铁如果你记得今天请转发微博我的家在东北松花江上那里有森林煤矿还有那满山遍野的大豆高粱年月日九一八事变爆发年间国土沦丧万同胞伤亡鲜血与抗争写就的历史警示国人落后就要挨打发展才能强大今天转发微博牢记九一八勿忘国殇吾辈自强展开全文
2018-09-17 17:00,厦门地铁快乐地铁邀您同行厦门地铁届管培生招聘期待您的加入
2018-09-13 15:58,#防骗益起来#,转发微博
2018-09-11 12:04,#厦门地铁最强大脑#,厦门地铁地铁列车回场需要控制中心做些什么呢今日更新的厦门地铁最强大脑第五章收车将为大家解答哦并不简单并不简单
2018-09-11 11:17,#扫黑除恶#,转发微博
2018-09-09 16:00,#感恩教师节#,厦门地铁明天厦门地铁感恩教师节园丁免费乘地铁同学们记得和老师说一句教师节快乐您辛苦了给你小心心给你小心心
2018-09-09 13:16,厦门地铁确认过眼神是参加过军训的人中国赞中国赞坐下的时候轻点不然屁股疼允悲允悲地铁会晃笑喷了的微博视频笑喷了的微博视频这位认真军训的同学请私信联系我们送你一只地铁宝宝爱萌啊坏笑坏笑
2018-09-07 12:32,肥菲非少女哈哈哈哈哈哈厦门地铁的闽南话真好玩啊微博视频微博视频
2018-09-06 10:35,#厦门地铁建设动态#,厦门地铁厦门地铁建设动态厦门地铁出行提示因厦门地铁号线土建施工火炬园号线换乘站桩基和基坑石方爆破作业需要将对爆破作业点周边道路米范围采取临时道路交通限制措施禁止机动车非机动车及行人通行每次交通限制时长约分钟计划爆破作业时间从年月日至年月日给您带来不便展开全文
2018-09-06 10:31,#厦门地铁建设动态#,厦门地铁厦门地铁建设动态厦门地铁出行提示因厦门地铁号线工程土建施工总承包创业桥站基坑石方爆破处理作业需要将对爆破作业点周边道路米范围采取临时道路交通限制措施禁止机动车非机动车及行人通行每次交通限制时长约分钟计划爆破作业时间从年月日至年月日给您带来的不展开全文
2018-09-05 15:39,厦门地铁坐地铁惠到家厦门地铁好康四连发本次好康共有个高频次乘客票卡送送送高校新生地铁免费坐教师节园丁地铁免费坐文明乘车进校园我铁第波好康是不是诚意满满记得绿色出行首选厦门地铁哦坐地铁惠到家厦门地铁好康四连发坐地铁惠到家厦门地铁好康四连发
2018-09-04 11:08,#上海地铁9号线故障#,奕格上海地铁号线故障感受一下厦门地铁的风景陈奕的秒拍视频陈奕的秒拍视频
2018-09-04 15:31,#厦门地铁最强大脑#,厦门地铁本周厦门地铁最强大脑更新咯憧憬憧憬在第四章施工计划审批及预演中将告诉您控制中心在安排每天运营结束后的施工之前都需要做些什么哦并不简单并不简单
2018-08-31 20:25,川子凉了啊好喜欢厦门地铁的报站喜欢闽南语给你小心心给你小心心厦门厦门
2018-08-31 11:51,厦门地铁厦门十周年生日快乐今天十岁啦感谢市民朋友们十年来的支持与陪伴厦门十周年生日快乐厦门十周年生日快乐
2018-08-30 09:00,厦门场站温馨提醒下雨下雨还是在下雨虽然凉快了点吃瓜吃瓜大家如果没有带伞的可以到车站找工作人员借爱心伞哦另外雨天路滑行走一定要注意特别是搭乘扶梯时一定要握紧扶手
2018-08-28 16:52,#厦门地铁最强大脑#,厦门地铁如果遇到车站站台门故障厦门地铁控制中心是如何指挥司机及车站进行故障处理呢疑问疑问厦门地铁最强大脑第三章应急处置站台门故障告诉你并不简单并不简单
2018-08-28 10:54,你想要娃娃机还是娃哈哈厦门地铁厦门地铁
2018-08-28 10:11,厦门地铁喏双手奉上你们心心念念的地铁文创给你小心心给你小心心快戳文章查看详情内附价格目录喏你们心心念念的地铁文创产品今天上线喏你们心心念念的地铁文创产品今天上线
2018-08-28 09:29,或者选择乘坐厦门地铁我们有风雨无忧服务给你小心心给你小心心如果忘带伞我铁小哥哥给你送雨衣给你小心心给你小心心我铁小姐姐给你送雨衣给你小心心给你小心心我铁小哥哥小姐姐一起给你送雨衣给你小心心给你小心心给你小心心给你小心心给你小心心给你小心心
2018-08-27 18:38,#我们这十年#,厦门地铁我们这十年我是厦门嘉庚中心站值班长苏毅璋在服务乘客的近个年头千余天万余小时里只要是在我本职工作内乘客有需要我就会去帮忙这是我的工匠精神厦门地铁的秒拍视频厦门地铁的秒拍视频
2018-08-27 10:07,#厦门地铁平安三率#,厦门地铁厦门地铁平安三率厦门地铁温馨提示携带大件行李的乘客请乘坐无障碍电梯近日某地一女子携带大件行李进入地铁站乘坐手扶梯时大件行李从扶梯上滚落砸中名女乘客其中一名女乘客伤势比较严重被送医治疗一名男子反应迅速得以幸免一手的秒拍视频一手的秒拍视频
2018-08-23 16:30,#厦门地铁出行提示#,厦门地铁厦门地铁出行提示因厦门地铁号线高崎停车楼匝道上跨成功大道建设需要年月日至日至在成功大道进行分次封闭围挡施工给您的出行造成不便请谅解感谢您对厦门地铁建设的谅解与支持厦门地铁号线高崎停车楼匝道跨线桥施工期厦门地铁号线高崎停车楼匝道跨线桥施工期
2018-08-23 12:00,#我们这十年#,厦门地铁我们这十年十周年十年坚守不忘初心十年回首一起来说说给您的生活带来了哪些改变给你小心心给你小心心厦门地铁的秒拍视频厦门地铁的秒拍视频
2018-08-23 09:16,熊家长带熊孩子微笑微笑微笑微笑微笑微笑
2018-08-23 08:46,厦门地铁今日处暑炎阳不再炙烤蝉儿不再鸣叫秋意愈来愈浓微风微风吃瓜吃瓜我厦门今年不知道要经历几次入秋失败哦新华网的秒拍视频新华网的秒拍视频
2018-08-22 10:02,#厦门地铁建设动态#,厦门地铁厦门地铁建设动态厦门地铁出行提示地铁号线火炬园换乘站爆破作业期间道路交通临时限限制提示因地铁号线土建施工火炬园号线换乘站桩基和基坑石方爆破作业需要将对爆破作业点周边道路米范围采取临时道路交通限制措施禁止机动车非机动车及行人通行每次交通限制时长约分钟计划展开全文
2018-08-22 09:58,#厦门地铁建设动态#,厦门地铁厦门地铁建设动态厦门地铁出行提示地铁号线创业桥站爆破作业期间道路交通临时限制提示因地铁号线工程土建施工创业桥站基坑石方爆破处理作业需要将对爆破作业点周边道路米范围采取临时道路交通限制措施禁止机动车非机动车及行人通行每次交通限制时长约分钟计划爆破作业时间展开全文
2018-08-21 15:14,#厦门地铁#,厦门地铁在盾构机圆满完成刘五店侧过海段掘进任务抵达两种工法交接点后将以矿山法继续施工由于盾构机只能向前掘进不能后退必须将盾构机解体拆除为矿山法施工提供作业面厦门地铁创造了国内首次隧道洞内盾构机弃壳解体作业天完成的新纪录
2018-08-21 14:56,#厦门地铁最强大脑#,厦门地铁想知道厦门地铁控制中心如何指挥地铁列车出车吗点开长文章厦门地铁最强大脑第二章告诉你并不简单并不简单厦门地铁最强大脑第二章出车厦门地铁最强大脑第二章出车
2018-08-21 13:00,#厦门地铁建设动态#,厦门地铁厦门地铁建设动态地铁号线创国内海底洞内盾构机弃壳解体新纪录厦门地铁号线创国内海底洞内盾构机弃壳解体厦门地铁号线创国内海底洞内盾构机弃壳解体
2018-08-20 17:30,#我的地铁故事#,厦门地铁我是温志攀厦门地铁安全技术部的一名综合执法管理员保障乘客乘车安全推动文明乘车是我的职责这是我的地铁故事给你小心心给你小心心厦门地铁的秒拍视频厦门地铁的秒拍视频
2018-08-18 19:05,#七夕情话#,厦门地铁七夕情话昨天七夕你有对象吗如果没有厦门地铁帮你在下个情人节虐别狗今天由厦门市总工会及厦门地铁组织的下一站爱情牵手会活动上线名单身青年男女通过厦门地铁相识相知共谱鹊桥恋曲活动最后在中山公园站一波牵手成功的狗粮你准备好接收了嘛二哈二哈
2018-08-17 15:04,#七夕情话#,厦门地铁七夕情话希望每个人都能找回对他们重要的东西最神奇的视频的秒拍视频最神奇的视频的秒拍视频
2018-08-16 15:03,#厦门地铁平安三率#,厦门地铁厦门地铁平安三率儿童水边安全知识话筒话筒从小宝宝在家里洗澡到户外的游泳池再到池塘海边小孩子喜欢玩水但要做好安全保障措施不要让孩子独自接近水边视线永远不要离开孩子人人视频的秒拍视频人人视频的秒拍视频公安部打四黑除四害公安部打四黑除四害
2018-08-15 11:07,厦门地铁即日起厦门地铁携手厦门空港快线开通机场接驳专线让您直达高崎国际机场候机楼今天首位乘坐地铁号线高崎站高崎国际机场接驳专线的乘客给你小心心给你小心心更多好康信息请戳链接坐地铁惠到家好康第波厦门地铁至高坐地铁惠到家好康第波厦门地铁至高
2018-08-15 10:19,厦门地铁坐地铁惠到家好康第波厦门地铁至高崎机场接驳专线开通啦好康不止这一点快点击长文章看看还有哪些吧给你小心心给你小心心坐地铁惠到家好康第波厦门地铁至高坐地铁惠到家好康第波厦门地铁至高
2018-08-15 10:01,#厦门地铁出行提示#,厦门地铁厦门地铁出行提示厦门地铁建设动态地铁火炬园号线换乘站爆破作业期间道路交通临时限制提示因厦门地铁号线土建施工火炬园号线换乘站桩基和基坑石方爆破作业需要将对爆破作业点周边道路米范围采取临时道路交通限制措施禁止机动车非机动车及行人通行每次交通限制时长约分钟展开全文
2018-08-15 10:00,#厦门地铁出行提示#,厦门地铁厦门地铁出行提示厦门地铁建设动态地铁号线爆破作业期间道路交通临时限制提示因地铁号线工程土建施工总承包创业桥站基坑石方爆破处理作业需要将对爆破作业点周边道路米范围采取临时道路交通限制措施禁止机动车非机动车及行人通行每次交通限制时长约分钟计划爆破作业时间从展开全文
2018-08-15 08:07,铭记历史珍爱和平
2018-08-14 16:40,秘密一直想去看海厦门还不错挺干净的很久没做地铁啦还好不是高峰期可爱可爱可爱可爱
2018-08-14 17:21,#我的地铁故事#,厦门地铁我的地铁故事厦门地铁最强大脑第一章运营前检查今日起我们将在每周推送厦门地铁最强大脑系列故事酷酷通过图文带大家一起走进厦门地铁控制中心探秘厦门地铁最强大脑憧憬憧憬厦门地铁最强大脑第一章运营前检查厦门地铁最强大脑第一章运营前检查
2018-08-14 15:37,沉迷舰的忆寻桑哟厦门地铁厦门地铁爱萌地铁文明号爱萌地铁文明号厦门地铁厦门地铁碰巧遇见在海面上经过的你可爱可爱
2018-08-14 08:20,绝望的背影不要笑嘛衰衰提醒大家可以下载厦门地铁啊乘车折折折偷笑偷笑还不怕掉缝里呦二维码也准备好了扫码就能下载给你小心心给你小心心查看图片
2018-08-13 17:40,#我的地铁故事#,厦门地铁我是陈清艺厦门地铁供电车间接触网组长简单的事情重复做重复的事情认真做把工作做细做好不仅是我的地铁故事更是我的工匠精神厦门地铁的秒拍视频厦门地铁的秒拍视频
2018-08-10 15:13,厦门地铁办公室空调坏掉的人儿不下工地也能高温作业微笑微笑以后不要再问我空调和二选一选哪个了我选空调泪泪泪泪必须是空调泪泪泪泪胖友们空调和二选一你们选啥吃瓜吃瓜
2018-08-10 11:31,厦门地铁长话短说坐地铁惠到家好康第波给你小心心给你小心心厦门地铁即日起购票折啦给你小心心给你小心心还有更多好康快看长文章坏笑坏笑坏笑坏笑坐地铁惠到家好康第波厦门地铁坐地铁惠到家好康第波厦门地铁
2018-08-10 11:13,厦门地铁招贤纳才厦门轨道交通集团资源开发事业总部关键岗位招聘有意者请于年月日前至厦门地铁官网网页链接网页链接招贤纳才板块进行简历投递微博微信不接受招聘咨询哦感谢您的配合招贤纳才厦门轨道交通集团资源开发事业总招贤纳才厦门轨道交通集团资源开发事业总
2018-08-09 10:42,#厦门地铁出行提示#,厦门地铁厦门地铁出行提示因施工需要厦门地铁号线莲坂站号口出站闸机现起暂停使用我们在号口进站闸机处启用台双向闸机方便乘客朋友出站乘客朋友也可从号口的出站闸机出站莲坂站号出入口通道正常使用如您需要帮助可咨询现场工作人员厦门地铁感谢您的理解与支持
2018-08-09 09:24,#厦门地铁平安三率#,厦门地铁平安三率小心电信诈骗又有新花样这些骗术究竟怎么回事对付黑科技诈骗应该注意什么戳图转发提醒千万警惕
2018-08-09 00:31,#噗DAYDAY#,诶哟喂啊噗噗实名赞扬厦门地铁位置中山公园站号出入口厦门地铁厦门地铁诶你怎么知道诶你怎么知道
2018-08-08 12:01,#北京奥运十年#,北京奥运十年那年你几岁呢还记得这首歌吗年让我们相约北京年冬奥会北京年冬奥会话说厦门地铁号线就岁啦偷笑偷笑
2018-08-08 11:05,#厦门地铁出行提示#,厦门地铁厦门地铁出行提示厦门地铁建设动态厦门地铁火炬园号线换乘站爆破作业期间道路交通临时限制提示因厦门地铁号线土建施工火炬园号线换乘站爆破作业需要将对爆破作业点周边道路米范围采取临时道路交通限制措施禁止机动车非机动车及行人通行每次交通限制时长约分钟计划爆破作业展开全文
2018-08-08 11:03,#厦门地铁出行提示#,厦门地铁厦门地铁出行提示厦门地铁建设动态厦门地铁号线创业桥站爆破作业期间道路交通临时限制提示因厦门地铁号线创业桥站基坑石方爆破处理作业需要将对爆破作业点周边道路米范围采取临时道路交通限制措施禁止机动车非机动车及行人通行每次交通限制时长约分钟计划爆破作业时间从展开全文
2018-08-08 09:40,#厦门地铁平安三率#,厦门地铁厦门地铁平安三率地铁站内偷拍男子被拘五日月初集美软件园站派出所接连接到几名女性乘客反映在地铁官任站乘坐手扶电梯时身后一名男子突然把手机伸向自己的裙底进行偷拍月日上午时许民警在官任站成功抓获正伺机偷拍的嫌疑人彭某心心厦门地铁温馨提示心心切勿选择沉默及展开全文
2018-08-07 09:00,厦门地铁厦门地铁车站客服热线我们用心服务聆听一鹭爱你爱你厦门地铁客服热线用心服务聆听一鹭厦门地铁客服热线用心服务聆听一鹭
2018-08-06 10:04,#厦门地铁正能量#,厦门地铁厦门地铁正能量关注社会公益事业厦门地铁牵手童心米奇比心米奇比心厦门地铁运营事业总部运营一公司党支部牵手童心厦门地铁运营事业总部运营一公司党支部牵手童心
2018-08-03 11:12,转发微博
2018-08-02 15:25,#厦门地铁出行提示#,厦门地铁厦门地铁出行提示据厦门市气象台消息预计未来小时有短时强降水并伴有强雷电以及级短时大风厦门地铁温馨提示雨天地滑请小心慢行若有需要地铁站内我们将为您提供风雨无忧服务心心
2018-08-02 15:08,#厦门身边事#,厦门地铁有风雨无忧服务厦门地铁有风雨无忧服务厦门地铁有风雨无忧服务
2018-08-01 17:00,厦门地铁老妈带儿子抢上地铁实力坑娃允悲允悲月日湖北武汉号线黄金口站一对母子抢上地铁失败妈妈上了地铁儿子却被拦在门外心心厦门地铁温馨提示为了您与家人的安全乘坐地铁时请勿抢上抢下人民网的秒拍视频人民网的秒拍视频
2018-08-01 16:12,#厦门地铁建设动态#,厦门地铁厦门地铁建设动态厦门地铁出行提示厦门地铁火炬园号线换乘站爆破作业期间道路交通临时限制的提示因厦门地铁号线土建施工火炬园号线换乘站爆破作业需要将对爆破作业点周边道路米范围采取临时道路交通限制措施禁止机动车非机动车及行人通行每次交通限制时长约分钟计划爆破作展开全文
2018-08-01 16:07,#厦门地铁建设动态#,厦门地铁厦门地铁建设动态厦门地铁出行提示厦门地铁号线创业桥站爆破作业期间道路交通临时限制的提示因厦门地铁号线创业桥站基坑石方爆破处理作业需要将对爆破作业点周边道路米范围采取临时道路交通限制措施禁止机动车非机动车及行人通行每次交通限制时长约分钟计划爆破作业时间从展开全文
2018-08-01 08:45,#我和军队的不解之缘#,共青团中央中国军队到中国人民解放军成立周年威武威武威武威武威武威武我和军队的不解之缘共青团中央的秒拍视频共青团中央的秒拍视频
2018-08-01 10:00,厦门地铁致敬为祖国驻守戍边最可爱的人心心祖国万多公里的边海防线漫漫绵长是上千个边防派出所和数百个边防检查站在绵延连接守护安防是万公安边防官兵日夜稳边固防致敬在驻守戍边中创造奇迹的人八一你的节日我的致敬警民携手同行的秒拍视频警民携手同行的秒拍视频紫光阁紫光阁
2018-08-01 09:24,#你好，八月#,这个八月一起加油你好八月
2018-07-31 09:22,厦门地铁大爷生命只有一次微笑微笑岁大爷抢地铁被夹被拉出后大骂工作人员摊手摊手月日武汉地铁号线一名多岁的男子抢上地铁被夹在车厢门和屏蔽门中间工作人员将大爷拉出来没想到大爷转身就锤他骂他王八蛋还辩称就晚了一分钟新京报我们视频的秒拍视频新京报我们视频的秒拍视频人民日报人民日报
2018-07-31 06:00,厦门地铁月日起厦门地铁热线和服务热线合并啦耶耶用心服务聆听一鹭厦门地铁以及场站范围内的各类咨询投诉和建议请拨打厦门地铁场站统一热线电话我们将竭诚为您服务米奇比心米奇比心
2018-07-30 15:30,灬佑佑厦门地铁厦门地铁月号这天真的非常感谢地铁高崎站工作人员我爷爷八十几岁一个人去坐地铁行动不是很方面一个女孩子穿黑色衣服黑色裤子来帮助我爷爷下去坐地铁等他上车了才走是因为晚上回来才讲爷爷是老红军南下倡导很多方面尤其今天这女孩子热心帮助老人家但爷爷拿的手机只能接听不然就给展开全文
2018-07-30 18:04,厦门地铁日本短片地铁里的各种人你中了几个吃瓜吃瓜热门的秒拍视频热门的秒拍视频人人视频人人视频
