2015-11-18 14:53,厦门地铁因地铁号线吕厝站江头站区间施工竖井需要定于年月日时至年月日时在位于吕岭路的莲秀路路口至江头西路路口段实施吕厝站江头站区间施工竖井工程围挡施工给您带来的不便敬请谅解
2015-11-16 16:33,厦门地铁因地铁号线东渡路站东港路路口爆破作业需要将对爆破作业点周边道路米范围采取临时道路交通限制措施禁止机动车非机动车及行人通行每次交通限制时长约分钟东渡路站爆破作业时间从年月日至年月日
2015-11-16 16:32,厦门地铁因地铁号线塘边站嘉禾路南山路路口火炬园站嘉禾路湖里大道路口和高殿站进出岛方向殿前公交站范围爆破作业需要将对爆破作业点周边道路米范围采取临时道路交通限制措施禁止机动车非机动车及行人通行每次交通限制时长约分钟爆破作业时间从年月日至月日
2015-11-13 13:00,厦门地铁厦门地铁邀您一起爱拼才会赢今天到周日厦门会展中心地铁展区高大上的盾构机模型与精彩地铁科普漫画来袭带上你家萌娃现场参与玩拼图晒合影活动并厦门地铁厦门地铁关注厦门地铁微博微信即有机会成为热心市民参与地铁开放日活动厦门地铁期待您来参与
2015-11-06 11:45,厦门地铁因地铁号线东渡路站东港路路口爆破作业需要将对爆破作业点周边道路米范围采取临时道路交通限制措施禁止机动车非机动车及行人通行每次交通限制时长约分钟东渡路站爆破作业时间从年月日至年月日
2015-11-06 11:44,厦门地铁因地铁号线塘边站嘉禾路南山路路口火炬园站嘉禾路湖里大道路口和高殿站进出岛方向殿前公交站范围爆破作业需要将对爆破作业点周边道路米范围采取临时道路交通限制措施禁止机动车非机动车及行人通行每次交通限制时长约分钟爆破作业时间年月日至年月日
2015-11-06 11:33,厦门地铁因地铁号线文灶站主体土建施工需要定于年月日时至年月日时在湖滨中路福建中烟工业公司门前路段及湖滨中路禾祥东路交叉口实施围挡施工给您带来的不便敬请谅解
2015-11-04 11:27,厦门地铁年月日厦门地铁号线莲花路口莲坂区间右线盾构隧道顺利贯通这是厦门轨道交通全面开工建设一年多来岛内首个贯通的盾构区间
2015-11-01 19:11,厦门地铁社会主义核心价值观公益广告善行无迹之一张票善行无迹之一张票善行无迹之一张票
2015-10-30 15:25,厦门地铁因轨道交通号线江头站雨水箱涵迁改需要定于年月日时至年月日时在位于吕岭路北侧辅路成功大道匝道口至双浦路路段实施江头站雨水箱涵迁改工程围挡施工给您带来的不便敬请谅解
2015-10-30 15:24,厦门地铁因轨道交通号线何厝站至观音山站主体土建建设需要定于年月日时至年月日时在半屏山路观日路路口至塔埔路路口段实施主体土建一期工程围挡施工给您带来的不便敬请谅解
2015-10-23 10:43,厦门地铁因轨道交通号线东渡路站东港路路口爆破作业需要将从年月日至年月日对爆破作业点周边米范围的机动车车辆非机动车车辆和行人进行交通临时限行管制每次交通管制时长约分钟请市民朋友们注意安全配合引导给您带来的不便请谅解
2015-10-23 10:43,厦门地铁因轨道交通号线塘边站火炬园站和高殿站爆破作业需要将从年月日至年月日对爆破作业点周边米范围的机动车车辆非机动车车辆和行人进行交通临时限行管制每次交通管制时长约分钟请市民朋友们注意安全配合引导给您带来的不便请谅解
2015-10-21 17:34,厦门地铁厦门地铁举办第一次市民开放日今天上午厦门地铁迎来了位热心市民市民们听取了关于线网规划建设进度质量安全监测措施等方面的介绍参观了地铁号线莲花路口站与正在掘进中的巨无霸盾构机亲密接触未来我们将继续举办地铁开放日活动请大家继续关心支持厦门地铁
2015-10-16 08:47,厦门地铁因轨道交通号线东渡路站东港路路口爆破作业需要将从年月日至年月日对爆破作业点周边米范围的机动车车辆非机动车车辆和行人进行交通临时限行管制每次交通管制时长约分钟请市民朋友们注意安全配合引导给您带来的不便请谅解
2015-10-16 08:47,厦门地铁因轨道交通号线塘边站火炬园站和高殿站爆破作业需要将从年月日至年月日对爆破作业点周边米范围的机动车车辆非机动车车辆和行人进行交通临时限行管制每次交通管制时长约分钟请市民朋友们注意安全配合引导给您带来的不便请谅解
2015-10-10 10:14,厦门地铁因轨道交通号线东渡路站东港路路口爆破作业需要将从年月日至年月日对爆破作业点周边米范围的机动车车辆非机动车车辆和行人进行交通临时限行管制每次交通管制时长约分钟请市民朋友们注意安全配合引导给您带来的不便请谅解
2015-10-10 10:14,厦门地铁因轨道交通号线塘边站火炬园站和高殿站爆破作业需要将从年月日至年月日对爆破作业点周边米范围的机动车车辆非机动车车辆和行人进行交通临时限行管制每次交通管制时长约分钟请市民朋友们注意安全配合引导给您带来的不便请谅解
2015-10-05 23:09,厦门地铁因轨道交通号线工程勘察施工需要定于年月至年月日在火炬路枋湖北二路钟宅路嘉禾路至环岛干道段进行勘探围挡施工总工期约为天请市民朋友们注意安全配合引导给您带来的不便请谅解
2015-10-05 23:07,厦门地铁因轨道交通号线东渡路站东港路路口爆破作业需要将从年月日至年月日对爆破作业点周边米范围的机动车车辆非机动车车辆和行人进行交通临时限行管制每次交通管制时长约分钟请市民朋友们注意安全配合引导给您带来的不便请谅解
2015-10-05 23:05,厦门地铁因轨道交通号线塘边站火炬园站和高殿站爆破作业需要将从年月日至年月日对爆破作业点周边米范围的机动车车辆非机动车车辆和行人进行交通临时限行管制每次交通管制时长约分钟请市民朋友们注意安全配合引导给您带来的不便请谅解
2015-10-01 12:24,厦门地铁举国欢庆齐欢畅快乐祝愿共分享厦门地铁祝全市人民国庆节快乐
2015-09-30 18:24,厦门地铁因地铁号线塘边站火炬园站和高殿站爆破作业需要将对爆破作业点周边米范围的机动车车辆非机动车车辆和行人进行交通临时限行管制每次交通管制时长约分钟其中塘边站火炬园站及高殿站爆破作业时间从年月日至年月日
2015-09-30 18:22,厦门地铁因地铁号线东渡路站东港路路口爆破作业需要将对爆破作业点周边米范围的机动车车辆非机动车车辆和行人进行交通临时限行管制每次交通管制时长约分钟东渡路站爆破作业时间从年月日至年月日
2015-09-30 18:21,厦门地铁因地铁号线工程勘察施工需要定于年月至年月日在火炬路枋湖北二路钟宅路嘉禾路至环岛干道段进行勘探围挡施工总工期约为天期间预计设有个勘探围挡作业点每个作业点围挡作业点分布于火炬路枋湖北二路钟宅路主车道及人行道上采用分期分段施工
2015-09-28 11:44,厦门地铁因轨道交通号线东渡路站东港路路口爆破作业需要将对爆破作业点周边米范围的机动车车辆非机动车车辆和行人进行交通临时限行管制每次交通管制时长约分钟东渡路站爆破作业时间从年月日至年月日请市民朋友们注意安全配合引导给您带来的不便敬请谅解
2015-09-28 11:41,厦门地铁因地铁号线塘边站火炬园站和高殿站爆破作业需要将对爆破作业点周边米范围的机动车车辆非机动车车辆和行人进行交通临时限行管制每次交通管制时长约分钟爆破作业时间从年月日至年月日请市民朋友们注意安全配合引导给您带来的不便敬请谅解
2015-09-25 15:30,厦门地铁因地铁号线一期工程勘探作业需要定于年月日至年月日在湖滨北路市政府大门至白鹭洲路口段进行勘探围挡作业期间共设有个勘探围挡作业点总工期天
2015-09-21 17:37,厦门地铁因地铁号线东渡路站东港路路口爆破作业需要将对爆破作业点周边米范围的机动车车辆非机动车车辆和行人进行交通临时限行管制每次交通管制时长约分钟东渡路站爆破作业时间从年月日至年月日请市民朋友们注意安全配合引导给您带来的不便敬请谅解
2015-09-21 17:36,厦门地铁因地铁号线塘边站火炬园站和高殿站爆破作业需要将对爆破作业点周边米范围的机动车车辆非机动车车辆和行人进行交通临时限行管制每次交通管制时长约分钟其中塘边站火炬园站及高殿站爆破作业时间从年月日至年月日请市民朋友们注意安全给您带来的不便敬请谅解
2015-09-16 16:29,厦门地铁鼓掌鼓掌鼓掌鼓掌年月日下午时厦门地铁号线天水路站厦门北站盾构区间左线顺利贯通这是厦门轨道交通全面开工建设一年多来第四个贯通的盾构区间由于盾构施工法的特点隧洞一旦打通就已经拼接成型日后这里就是地铁车辆穿行地底的通道厦门地铁号线天水路站厦门北站盾构区间左厦门地铁号线天水路站厦门北站盾构区间左
2015-09-11 11:55,厦门地铁因轨道交通号线东渡路站东港路路口爆破作业需要将对爆破作业点周边米范围的机动车车辆非机动车车辆和行人进行交通临时限行管制每次交通管制时长约分钟东渡路站爆破作业时间从年月日至年月日
2015-09-09 12:01,厦门地铁因轨道交通号线软件园站主体土建建设需要定于年月日时至年月日时在位于三安光电研发中心门前的吕岭路北侧路段实施软件园站主体土建一期工程围挡施工给您带来的不便敬请谅解和支持我发表了文章厦门市轨道交通号线软件园站主体土建一期工厦门市轨道交通号线软件园站主体土建一期工查看图片
2015-09-03 08:58,厦门地铁纪念中国人民抗日战争暨世界反法西斯战争胜利周年
2015-08-31 17:24,厦门地铁年月日至年月日因地铁号线塘边站火炬园站和高殿站爆破作业需要将对爆破作业点周边米范围的机动车车辆非机动车车辆和行人进行交通临时限行管制每次交通管制时长约分钟请市民朋友们注意安全请市民朋友们注意安全配合引导给您带来的不便请谅解
2015-08-28 12:49,厦门地铁因地铁号线将军祠站主体土建建设需要定于年月日时至年月日时在文园路将军祠路路口实施将军祠站主体土建二期三期工程围挡施工给您带来的不便敬请谅解和支持我发表了文章厦门市轨道交通号线将军祠站主体土建二期厦门市轨道交通号线将军祠站主体土建二期
2015-08-26 11:41,厦门地铁将军祠站至文灶站区间竖井塌陷抢险基本完成昨日下午时现场混凝土灌注作业完成昨日夜间时通讯管线已完成抢修作业自来水管的抢修工作已于今日凌晨完成上午时起逐步恢复管道供水下阶段将加强区域周边的监测安全巡查制定专项处置方案组织专家论证尽快恢复施工
2015-08-25 19:41,厦门地铁将军祠站至文灶站区间竖井塌陷抢险正在进行中今天晚间完成抢修作业将军祠站至文灶站区间竖井塌陷抢险正在进行中将军祠站至文灶站区间竖井塌陷抢险正在进行中
2015-08-25 12:23,厦门地铁将军祠站至文灶站区间竖井塌陷抢险正在进行中今天将抢修完成将军祠站至文灶站区间竖井塌陷抢险正在进行中将军祠站至文灶站区间竖井塌陷抢险正在进行中
2015-08-25 09:01,厦门地铁今日凌晨时左右号线工程将军祠站至文灶站区间竖井施工现场出现地表砂砾层沉降导致自来水管破裂引发塌陷塌陷发生后轨道集团施工单位立即制定抢险方案投入抢险人员和设备进行抢险截至时现场情况安全可控无人员伤亡目前塌陷现场开始混泥土灌注施工作业预计中午混凝土浇注完成
2015-08-24 15:41,#爆破提醒#,厦门地铁爆破提醒年月日至年月日因地铁号线塘边站嘉禾路南山路路口火炬园站嘉禾路湖里大道路口和高殿站进出岛方向殿前公交站范围爆破作业需要将对爆破作业点周边米范围的机动车车辆非机动车车辆和行人进行交通临时限行管制每次交通管制时长约分钟
2015-08-19 09:27,厦门地铁因地铁号线将军祠站建设需要月日至年月日在文园路将军祠路路口实施将军祠站主体土建二期三期工程围挡施工期间文园路与将军祠路交叉路口禁止车辆左转请市民朋友们注意安全配合引导给您带来的不便请谅解
2015-07-24 19:03,#我们的价值观#,厦门地铁中国梦梦娃系列公益广告展播我们的价值观中国梦我的梦孝当先孝当先孝当先交通安全爱的纽带交通安全爱的纽带交通安全爱的纽带
2015-07-24 10:35,厦门地铁好员工远不止一两位轨道人典型处处闪现我们没有号召大家向林正学习是因为林正这样的员工在我们公司不是一两个他是我们大多数好员工中的一员他的故事多数轨道人身上或多或少都有闪现好员工远不止一两位轨道人典型处处闪现好员工远不止一两位轨道人典型处处闪现
2015-07-24 10:31,厦门地铁因轨道交通号线塘边站火炬园站和高殿站爆破作业需要将从年月日至年月日对爆破作业点周边米范围的机动车车辆非机动车车辆和行人进行交通临时限行管制请市民朋友们注意安全配合引导给您带来的不便请谅解
2015-07-17 11:28,厦门地铁因轨道交通号线塘边站火炬园站和高殿站爆破作业需要从年月日至年月日将对爆破作业点周边米范围的机动车车辆非机动车车辆和行人进行交通临时限行管制请市民朋友们注意安全配合引导给您带来的不便请谅解
2015-07-13 09:20,#我们的价值观#,厦门地铁中国梦梦娃系列公益广告展播我们的价值观中国梦我的梦勤为本勤为本勤为本中华有福行善是福中华有福行善是福中华有福行善是福
2015-07-11 07:34,厦门地铁因轨道交通号线塘边站嘉禾路南山路路口火炬园站嘉禾路湖里大道路口和高殿站进出岛方向殿前公交站范围爆破作业需要将从年月日至年月日对爆破作业点周边米范围进行交通临时限行管制请市民朋友们注意安全配合引导给您带来的不便请谅解
2015-07-11 07:33,厦门地铁因轨道交通地质勘探施工需要定于年月至年月日在湖滨东路长岸路湖里大道进行分期分段围挡勘探施工总工期约为天请市民朋友们注意安全配合引导给您带来的不便请谅解
2015-06-29 10:23,#我们的价值观#,厦门地铁中国梦梦娃系列公益广告展播我们的价值观梦娃送吉祥送美德梦娃送吉祥送美德梦娃送吉祥送美德文明中国人开车篇文明中国人开车篇文明中国人开车篇
2015-06-27 13:32,厦门地铁轨道交通号线官任站诚毅广场站盾构区间右线顺利洞通啦太开心太开心年月日上午时厦门地铁号线官任站原暂定名集美中心站诚毅广场站盾构区间的右线顺利洞通该区间左线已于今年月初顺利洞通这是地铁号线首个双向洞通的盾构区间威武威武
2015-06-25 17:15,厦门地铁哆啦梦花心哆啦梦花心哆啦梦花心哆啦梦花心这是思明区小学三年级语文期末通考试卷棒棒哒鼓掌鼓掌鼓掌鼓掌大朋友小朋友们你们知道厦门的地铁元年是哪一年吗感谢热心网友
2015-06-25 09:31,厦门地铁因地铁号线镇海路站主体土建建设需要年月日至年月日在镇海路海景酒店门前路段及镇海路与思明南路交叉口实施镇海路站主体土建三期工程围挡施工请市民朋友们注意安全配合引导给您带来的不便请谅解
2015-06-23 10:48,厦门地铁因地铁号线将军祠站主体土建建设需要日起至年月号在文园路将军祠路路口实施将军祠站主体土建一期工程围挡施工请市民朋友们注意安全配合引导给您带来的不便请谅解
2015-06-19 17:20,#我们的价值观#,厦门地铁中国梦梦娃系列公益广告展播我们的价值观中国梦我的梦俭养德俭养德俭养德请勿喧哗篇请勿喧哗篇请勿喧哗篇
2015-06-18 15:24,厦门地铁年月日至年月日将军祠站主体土建一期工程进行围挡施工施工期间文园路与将军祠路路口四个方向禁止车辆左转通行公交车除外路公交车减停将军祠站此次交通管制对文园路沿线的市民朋友出行影响较大给您带来的不便敬请谅解
2015-06-17 11:19,厦门地铁地铁建设者冒着酷暑坚持施工高崎站盾构机有望下月始发地铁建设者冒着酷暑坚持施工高崎站盾构机有地铁建设者冒着酷暑坚持施工高崎站盾构机有
2015-06-16 17:34,厦门地铁月日至月日因地铁号线塘边站嘉禾路南山路路口火炬园站嘉禾路湖里大道路口和高殿站进出岛方向殿前公交站范围爆破作业需要将对爆破作业点周边米范围的机动车非机动车和行人进行交通临时限行管制请市民朋友们注意安全配合引导给您带来的不便请谅解
2015-06-08 21:48,厦门地铁中国梦梦娃系列公益广告展播和为贵和为贵和为贵乘车环境靠大家乘车环境靠大家乘车环境靠大家
2015-06-05 17:57,#随手拍厦门#,谢谢拍照拍照这是我与地铁共成长主题绘画活动的部分优秀作品
2015-06-04 15:42,#好人365#,一句简单的承诺一颗善良的心灵十年默默的坚持厦门文明网厦门文明网好人岁到岁一句承诺坚守了十年多个日日夜夜她用自己的爱心支撑起同伴残障的肢体也成就了不一样的人生故事
2015-06-02 09:29,厦门地铁因地铁号线高殿站建设需要定于本周六月日零时至年月日时实施高殿站主体土建二期第五阶段工程围挡施工请市民朋友们注意安全配合引导给您带来的不便请谅解
2015-05-30 09:42,厦门地铁因地铁号线爆破作业需要将从月日至月日对塘边站火炬园站高殿站进行爆破作业点周边米范围的机动车非机动车和行人进行交通临时限行管制请市民朋友们注意安全配合引导给您带来的不便请谅解
2015-05-27 10:23,厦门地铁因湖滨南路金榜路路口管线迁改施工需要为确保施工期间道路交通安全畅通年月日时至年月日时湖滨南路金榜路南侧路口将采取道路交通限制措施请市民朋友们注意安全配合引导给您带来的不便请谅解
2015-05-25 21:11,厦门地铁中国梦梦娃系列公益广告国是家国是家国是家爱护公共措施网页链接网页链接
2015-05-22 10:36,厦门地铁因地铁号线塘边站嘉禾路南山路路口火炬园站嘉禾路湖里大道路口和高殿站进出岛方向殿前公交站范围爆破作业需要将对爆破作业点周边米范围的机动车非机动车和行人进行交通临时限行管制每次交通管制时长约分钟请市民朋友们注意安全配合引导给您带来的不便敬请谅解
2015-05-19 16:04,#寻找厦门地铁达人#,拍手拍手恭喜
2015-05-19 16:03,恭喜哦我们后期还会有活动请大家多多关注哦
2015-05-19 15:38,厦门地铁地铁达人们来领奖啦得意地笑恭喜在寻找厦门地铁达人幸运中奖的小伙伴们获得价值元厦门地铁厦门地铁定制版通卡一张请各位达人们于月日前工作日凭厦门客户服务厦门客户服务中奖私信到厦门市思明区软件园二期观日路号单元区新浪厦门新闻中心领取定制版通卡抓紧时间哦太开心太开心
2015-05-13 11:14,厦门地铁因地铁号线湖滨东路站主体土建建设需要为确保施工期间道路交通安全畅通决定从本周六月日零时至年月日时对湖滨南路湖滨东路路口采取道路交通限制措施请市民朋友们注意安全配合引导给您带来的不便敬请谅解
2015-04-28 16:45,#寻找厦门地铁达人#,第二波游戏通关中奖名单新鲜出炉啦恭喜以下小伙伴在地铁达人游戏中全胜通过获得价值元厦门地铁厦门地铁定制版通卡快快厦门客户服务厦门客户服务告诉他你们的联系方式吧太开心太开心太开心太开心
2015-04-28 12:00,#寻找厦门地铁达人#,插画第十季完结篇文明厦门人人有责美丽厦门你我共筑得意地笑得意地笑得意地笑
2015-04-27 11:15,#寻找厦门地铁达人#,地铁施工过程中管线改迁是个难题跟随博士和小新小浪一起来探个究竟吧真群体围观
2015-04-24 10:30,#寻找厦门地铁达人#,熊猫熊猫什么是拥而不堵占一还一三级分流第八季带你把交通疏解看得清清楚楚明明白白真真切切地铁建设期间会给交通带来一定压力给交通出行带来一定不便感谢市民朋友们的理解与支持也为辛勤付出的警察蜀黍点赞亲一口
2015-04-24 09:46,厦门地铁因地铁线塘边站嘉禾路南山路路口火炬园站嘉禾路湖里大道路口和高殿站进出岛方向殿前公交站范围爆破作业需要月日至月日将对爆破作业点周边米范围的机动车非机动车和行人进行交通临时限行管制请市民朋友们注意安全配合引导给您带来的不便敬请谅解
2015-04-23 11:23,#寻找厦门地铁达人#,厦门的地质复杂程度堪比博物馆地质千层糕孤石大块头基岩小顽固让探索三人组带我们一探究竟吧
2015-04-22 11:09,#寻找厦门地铁达人#,眨眼眨眼第季告诉您关于地铁施工和噪音的那些事感谢市民朋友们对厦门地铁的理解与支持
2015-04-21 10:50,#寻找厦门地铁达人#,杰克逊博士唱我曾经爱过小新小浪也抱过盾构一台摇滚摇滚摇滚
2015-04-21 09:45,厦门地铁因地铁号线湖滨东路站主体土建建设需要定于本周日月日零时至年月日时在湖滨南路金榜路路口湖滨东路路口路段实施湖滨东路站主体土建四期第二次工程围挡施工请市民朋友们注意安全配合引导给您带来的不便敬请谅解
2015-04-20 11:44,#寻找厦门地铁达人#,本期特映管线奇缘树木去哪儿基坑笔记明挖着联盟半盖挖再爱我一次欢迎收看群体围观群体围观群体围观
2015-04-17 10:53,#寻找厦门地铁达人#,从此大象就和盾构机幸福的生活在了一起喵喵喵喵啊不是是博士和小新小浪幸福的生活在了一起得意地笑
2015-04-16 11:08,#寻找厦门地铁达人#,江南江南江南第季十万个为什么之线路站点规划万万没想到小浪就此走上了人生巅峰
2015-04-15 11:08,#寻找厦门地铁达人#,拍手拍手第季数据告诉你厦门为什么要建地铁小伙伴们快来一起来看漫画涨姿势吧
2015-04-13 15:23,厦门地铁根据美丽厦门战略规划我市到年将建成地铁号线总里程约公里形成轨道交通骨干网今年是我市轨道交通建设的关键年号线将全部开工其中号线全面推进号线全面开工号线控制性工程年底开工我发表了文章厦门地铁开工建设一周年推进速度加快厦门地铁开工建设一周年推进速度加快
2015-04-13 10:56,#寻找厦门地铁达人#,江南江南江南寻找厦门地铁达人活动号开始大家记得要来参加哟转圈喵喵喵喵
2015-04-11 12:37,厦门地铁因地铁号线塘边站嘉禾路南山路路口火炬园站嘉禾路湖里大道路口和高殿站进出岛方向殿前公交站范围爆破作业需要将从年月日至月日对爆破作业点周边米范围的机动车非机动车和行人进行交通临时限行管制请市民朋友们注意安全配合引导给您带来的不便敬请谅解
2015-04-10 12:44,厦门地铁厦门地铁号线第一条盾构区间贯通啦今天上午时成功号盾构机巨大锋利的刀盘钻破最后一层水泥土块地铁号线官任站原暂定名集美中心站诚毅广场站盾构区间左线贯通盾构机顺利到达接收竖井该区间盾构机于去年月日始发掘进历时天掘进全长米
2015-04-09 09:23,厦门地铁因地铁号线集美学村站园博苑站区间主体土建建设需要本周日月日零时至年月日时在集杏海堤路园博苑西大门广场南侧路段实施集美学村站园博苑站区间主体土建二期工程围挡施工进行交通管制请市民朋友们注意安全配合引导给您带来的不便敬请谅解
2015-04-06 10:19,厦门地铁因地铁号线塘边站火炬园站和高殿站爆破作业需要将对爆破作业点周边米范围的机动车非机动车和行人进行交通临时限行管制每次交通管制时长约分钟这三个站点的爆破作业时间均从月日至日请市民朋友注意安全配合引导给您带来的不便敬请谅解
2015-04-03 10:10,厦门地铁因地铁号线文灶站主体土建建设需要定于年月日零时至年月日时在位于湖滨中路的厦禾路湖滨中路交叉口至湖滨中路禾祥东西路交叉口路段实施地铁号线文灶站主体土建二期工程围挡施工湖滨中路怎么走请您看视频年月日至月日湖滨中路文灶路段单向年月日至月日湖滨中路文灶路段单向
