2018-04-24 13:49,青岛地铁微博会员特权置顶最新号线号线号线号线首末班车时间以及换乘时间表来了
2019-04-17 10:05,青岛地铁中国最美地铁投票啦快来为咱青岛地铁投票吧投票请识别图中二维码
2019-04-15 18:12,#青岛发布#,转发微博
2019-04-15 18:11,#青岛发布#,转发微博
2019-04-15 18:10,青岛地铁喊话青岛地铁乘客失物招领啦温馨提示拾遗物品招领号统计温馨提示拾遗物品招领号统计
2019-04-15 18:09,青岛地铁最新进展地铁号线泰山路站站厅层全面贯通最新进展地铁号线泰山路站站厅层全面贯通最新进展地铁号线泰山路站站厅层全面贯通
2019-04-14 10:50,#青岛发布#,扩散周知
2019-04-14 10:43,青岛地铁中国赞中国赞分秒月日起号线工作日早高峰行车间隔再压缩中国赞中国赞自月日起将调整号线列车运行图号线工作日早高峰行车间隔压缩至分秒乘客出行最高峰时段行车间隔压缩至分秒为配合号线运行图调整号线工作日运行图也进行了微调
2019-04-14 08:28,青岛地铁春和景明花开岛城看花攻略来啦春和景明花开岛城看花攻略来啦春和景明花开岛城看花攻略来啦
2019-04-12 21:42,青岛地铁向地铁职业乞讨族吧由于地铁人员流动性大地铁车厢已逐渐成为不少职业乞讨者眼中发家致富的宝地尽管地铁行政执法人员已对地铁乞讨行为加大了的打击力度但随着职业乞讨族的来袭地铁运营秩序仍受到了不小的挑战月日下午青岛地铁行政执法人员在号展开全文
2019-04-10 17:44,青岛地铁清明假期青岛地铁运营情况都挺好清明假期青岛地铁运营情况都挺好清明假期青岛地铁运营情况都挺好
2019-04-10 17:42,青岛地铁地铁号线首次始发地铁号线首次始发地铁号线首次始发
2019-04-08 18:00,青岛地铁温馨提示拾遗物品招领号统计温馨提示拾遗物品招领号统计温馨提示拾遗物品招领号统计
2019-04-08 17:59,青岛地铁加油加油清明小长假地铁全网客流近万人次月日日地铁客流明显增长根据青岛市交通运输委官方发布的数据清明假期全网客流量达到万人次月日清明节当天青岛地铁线网总客流达到了万人次创造了历史新高三天假期青岛站客流量达到万人次青岛北站客流量达到万人展开全文
2019-04-08 17:58,青岛地铁青岛地铁首个社会实践基地挂牌青岛地铁首个社会实践基地挂牌青岛地铁首个社会实践基地挂牌
2019-04-08 17:57,青岛地铁建设新进展号线科技馆站封顶发起建设新攻势青岛地铁号线科技馆站封顶发起建设新攻势青岛地铁号线科技馆站封顶
2019-04-06 15:14,青岛地铁新纪录月日清明小长假第一天青岛地铁迎来了出行高峰日客流量突破万达万人次刷新单日客流量记录月日当天号线客流万人次号线客流万人次号线客流万人次号线客流万人次客流量较为集中的车站分别是号线青岛站青岛北站中山公园展开全文
2019-04-05 18:38,青岛地铁清明祭英烈传承红色基因弘扬先烈精神
2019-04-04 13:48,青岛地铁青岛地铁伴您春游踏青缅怀故人青岛地铁的秒拍视频青岛地铁的秒拍视频
2019-04-03 18:00,青岛地铁坐地铁去看樱花这些信息你要掌握樱花季青岛地铁真情相伴助力乘客出行畅达樱花季青岛地铁真情相伴助力乘客出行畅达
2019-04-03 14:28,青岛地铁中国赞中国赞月日下午青岛地铁号线工区崂西区间崂山六中站西登瀛站进行了首次开挖爆破施工经鉴定爆破应力释放均匀无盲炮哑炮无超欠挖爆破效果满足要求号线从人民会堂站到大河东站全长约公里经过市南区市北区崂山区与已开通的号线号线号线换乘目前展开全文
2019-04-03 14:27,青岛地铁清明假期期间号线较周末运行图加密行车间隔号线采用目前周末运行图调整后号线高峰期行车间隔由分秒压缩至分秒号线苗岭路站至博览中心站号线井冈山路站至大珠山站行车间隔由目前周末的分秒压缩至分秒并相应压缩号线博览中心站至钱谷山站号线大珠展开全文
2019-04-02 15:21,青岛地铁衣物杯子手机证件钱包音响行李箱字画钥匙背包水彩笔电钻没有不丢的本期件失物还未找到失主赶紧来认领啦温馨提示拾遗物品招领号统计温馨提示拾遗物品招领号统计
2019-04-02 15:16,青岛地铁垃圾清理挑战你能得几分现在又有一项全球流行的挑战开始接力昨天现在又有一项全球流行的挑战开始接力昨天
2019-04-01 08:27,青岛地铁今日说地铁欢迎收看今日说地铁想带违禁品安检可不答应今日说地铁想带违禁品安检可不答应青岛地铁的微博视频青岛地铁的微博视频
2019-04-01 08:26,青岛地铁安全乘车小常识丨教你远离被罚站安全乘车小常识丨教你远离被罚站安全乘车小常识丨教你远离被罚站
2019-04-01 08:19,青岛地铁阳春三月坐地铁踏青看花指南阳春三月坐地铁踏青看花指南阳春三月坐地铁踏青看花指南
2019-03-28 18:49,青岛地铁当乘地铁遇上大客流当乘地铁遇上大客流当乘地铁遇上大客流
2019-03-28 18:48,青岛地铁最美地铁保洁就是她最美地铁保洁就是她附地铁站内丢最美地铁保洁就是她附地铁站内丢青岛地铁的微博视频青岛地铁的微博视频
2019-03-28 18:47,青岛地铁最近地铁传媒全媒体在忙一件事你也能在号线和号线列地铁上看到最近地铁传媒全媒体在忙一件事你也能在最近地铁传媒全媒体在忙一件事你也能在
2019-03-28 12:05,青岛地铁中国赞中国赞两万现金遗落地铁站最美地铁保洁员拾金不昧让失主感动不已两万现金遗落地铁站最美地铁保洁员拾金不两万现金遗落地铁站最美地铁保洁员拾金不
2019-03-27 16:48,青岛地铁开放现代活力时尚
2019-03-25 18:01,青岛地铁月日份乘客拾遗物品招领启事丢东西的看过来啦温馨提示拾遗物品招领号统计温馨提示拾遗物品招领号统计
2019-03-25 18:00,青岛地铁今天我郑重向您借三分钟借我三分钟借我三分钟青岛地铁的秒拍视频青岛地铁的秒拍视频
2019-03-25 17:58,青岛地铁说话就可以买票一起来看看青岛地铁的黑科技说话就可以买票青岛地铁云购票机又添黑科说话就可以买票青岛地铁云购票机又添黑科
2019-03-22 18:22,青岛地铁幸福来得太突然五一小长假突然归来你想好怎么过了吗杜鹃花香服务贴心这是珠山春天的味道杜鹃花香服务贴心这是珠山春天的味道
2019-03-22 11:51,青岛地铁坐地铁享优惠青岛地铁票务优惠政策看过来来来青岛地铁票务优惠政策知多少青岛地铁票务优惠政策知多少
2019-03-21 13:32,#春天来了#,今天春分在昨天一场大雨过后今日春光无限好中国赞中国赞想出去浪二哈二哈人民日报人民日报
2019-03-21 11:44,青岛地铁吃惊吃惊人冒用他人优惠乘车卡坐地铁都被查了人冒用他人优惠乘车卡坐地铁都被查了人冒用他人优惠乘车卡坐地铁都被查了
2019-03-20 09:28,青岛地铁地铁现已恢复正常给您带来的不便请谅解感谢您对青岛地铁的关注
2019-03-20 08:45,青岛地铁因网络原因导致部分车站地铁无法正常获取二维码工作人员正在抓紧时间恢复请您根据车站人员指引有序进出站若有问题请及时拨打地铁热线给您带来的不便请谅解
2019-03-18 17:20,青岛地铁地铁内向吸烟说地铁内向吸烟说地铁内向吸烟说
2019-03-18 09:02,青岛地铁青岛地铁新增公交乘车功能地铁与公交真正一键畅行青岛地铁新增公交乘车功能地铁与公交真正青岛地铁新增公交乘车功能地铁与公交真正
2019-03-18 09:00,青岛地铁乘坐地铁勿饮食你能做到吗乘坐地铁勿饮食你能做到吗乘坐地铁勿饮食你能做到吗
2019-03-18 08:58,青岛地铁什么才是正确的候车姿势什么才是正确的候车姿势什么才是正确的候车姿势
2019-03-18 08:57,青岛地铁财物失而复得乘客感激道谢财物失而复得乘客感激道谢财物失而复得乘客感激道谢
2019-03-18 08:56,青岛地铁乘坐地铁时这些贴纸您注意到了吗乘坐地铁时这些贴纸您注意到了吗乘坐地铁时这些贴纸您注意到了吗
2019-03-15 21:39,青岛地铁青岛地铁幸福接力志愿服务手语培训暨社会志愿者交流会顺利召开月日下午青岛地铁幸福接力志愿服务手语培训暨社会志愿者交流会在辽阳东车辆段阶梯教室顺利召开余名青岛地铁社会志愿者参加了本次会议会议特别邀请青岛市中心聋校手语教师对志愿者进行了志愿服务手语专项培训将常用展开全文
2019-03-13 18:00,青岛地铁青岛地铁项服务承诺能不能做到请您来监督青岛地铁运营服务承诺出炉欢迎您的监督青岛地铁运营服务承诺出炉欢迎您的监督
2019-03-12 18:45,青岛地铁对地铁安检有疑问的过来了解一哈驻足片刻有疑虑安检设备来解答驻足片刻有疑虑安检设备来解答
2019-03-12 18:40,青岛地铁年校园招聘启动招募位精英看岗位要求进行报名啦运营分公司届高校应届毕业生校园招聘公告运营分公司届高校应届毕业生校园招聘公告
2019-03-11 18:09,青岛地铁今日份地铁失物招领有你的东西么速来认领温馨提示拾遗物品招领号统计温馨提示拾遗物品招领号统计
2019-03-11 18:05,青岛地铁加油加油今天的地铁运力你感受到了吗加油加油月日起青岛地铁号线工作日早高峰进一步压月日起青岛地铁号线工作日早高峰进一步压
2019-03-07 13:51,#全国两会#,早上点你是否也奔波在奋斗的路上
2019-03-06 15:58,青岛地铁加油加油青岛地铁地产开门红青岛地铁的秒拍视频青岛地铁的秒拍视频
2019-03-05 17:37,青岛地铁好消息今年年底可以坐着地铁逛台东啦好消息地铁号线西段进入冲刺阶段全线将于好消息地铁号线西段进入冲刺阶段全线将于
2019-03-05 17:36,青岛地铁铁丝儿福利寻人启事说说你身边的雷峰到微信公众号留言留言被精选者可获得地铁纪念品一份铁丝儿福利寻人启事说说你身边的雷峰铁丝儿福利寻人启事说说你身边的雷峰
2019-03-05 17:35,青岛地铁温馨提示拾遗物品招领号统计温馨提示拾遗物品招领号统计温馨提示拾遗物品招领号统计
2019-03-01 09:06,我就叫不去想小姐感谢青岛地铁青岛地铁提供了免费的公共无线网络感谢自己开动了小脑袋可以让我在手机欠费上不去网充不了值打不了电话的时候充上话费重新和世界连接关键时刻真是发现老爸老公都不如和自己靠谱有用
2019-03-01 09:25,#齐鲁时代楷模#,齐鲁时代楷模我有信仰自光芒齐鲁时代楷模特别策划年月日齐鲁时代楷模发布厅将发布一位时代楷模敬请期待新浪山东的秒拍视频
2019-02-28 16:44,#正能量#,青岛地铁乘客突发抽搐车站齐心救援乘客突发抽搐车站齐心救援乘客突发抽搐车站齐心救援正能量
2019-02-26 10:28,青岛地铁米妮爱你米妮爱你祝贺地铁集团荣膺省级文明单位殊荣地铁集团荣膺省级文明单位殊荣
2019-02-26 10:27,青岛地铁杜哥火了跪了跪了神秘的地铁指挥官后的值班主任杜东先神秘的地铁指挥官后的值班主任杜东先
2019-02-26 10:24,青岛地铁地铁乘客拾遗物品招领号统计温馨提示拾遗物品招领号统计温馨提示拾遗物品招领号统计
2019-02-26 10:24,青岛地铁给家里老人备一份老年人乘坐地铁宝典给家里老人备一份老年人乘坐地铁宝典给家里老人备一份老年人乘坐地铁宝典
2019-02-22 17:52,#正能量#,青岛地铁夜空中最亮的星夜空中最亮的星夜空中最亮的星正能量
2019-02-21 17:47,青岛地铁失物招领啦在地铁站遗失的物品在召唤它们的主人温馨提示拾遗物品招领号统计温馨提示拾遗物品招领号统计
2019-02-21 11:18,青岛地铁地铁人的元宵节地铁人的元宵节地铁人的元宵节
2019-02-19 10:59,青岛地铁青岛地铁与您共度佳节祝大家元宵节快乐青岛地铁的秒拍视频青岛地铁的秒拍视频
2019-02-18 11:46,青岛地铁关于节后复工安全生产的一封公开信关于节后复工安全生产的一封公开信关于节后复工安全生产的一封公开信
2019-02-14 15:12,青岛地铁青岛地铁全力保障乘客雪天安全出行以雪为令地铁人在行动以雪为令地铁人在行动
2019-02-14 07:27,青岛地铁青春盛宴爱情节地铁乘载你的爱地铁约情人节地铁四线鹊桥号千人陪地铁约情人节地铁四线鹊桥号千人陪
2019-02-14 07:22,青岛地铁我们的节日春节我们的节日春节我们的节日春节
2019-02-11 17:49,#春节168小时#,青岛地铁年月日至月日农历春节天长假期间青岛地铁总客运量为万人次日均客运量万人次较去年春节日均客流量上升春节小时
2019-02-10 09:26,青岛地铁知否知否之揭秘列车停运后的地铁车站知否知否之揭秘列车停运后的地铁车站知否知否之揭秘列车停运后的地铁车站
2019-02-08 08:05,青岛地铁地铁车辆段里的春节地铁车辆段里的春节地铁车辆段里的春节
2019-02-08 08:03,青岛地铁轨道上的坚守我为春节保驾护航轨道上的坚守我为春节保驾护航轨道上的坚守我为春节保驾护航
2019-02-06 07:39,青岛地铁教人意气忆长安记一群不回家的人教人意气忆长安记一群不回家的人教人意气忆长安记一群不回家的人
2019-02-06 07:38,青岛地铁畅达地铁梦同心筑幸福畅达地铁梦同心筑幸福畅达地铁梦同心筑幸福
2019-02-06 07:36,青岛地铁守护安全出行春节保障我们来了守护安全出行春节保障我们来了守护安全出行春节保障我们来了
2019-02-06 07:34,青岛地铁最赞敬业福致春节坚守在一线的地铁人最赞敬业福致春节坚守在一线的地铁人最赞敬业福致春节坚守在一线的地铁人
2019-02-06 07:28,青岛地铁坚守一线把更多的爱运送回家坚守一线把更多的爱运送回家坚守一线把更多的爱运送回家
2019-02-06 07:21,青岛地铁青岛地铁与您共度佳节青岛地铁与您共度佳节青岛地铁与您共度佳节
2019-02-05 08:02,#新春旺好运#,青岛地铁新春旺好运恭祝大家新春快乐阖家幸福
2019-02-03 13:49,青岛地铁回家路上我们陪你回家路上我们陪你回家路上我们陪你
2019-02-02 15:44,#春节168小时#,青岛地铁青岛人青岛人春节期间限放烟花爆竹燃放时间禁燃地点一定要看准青岛人春节期间限放烟花爆竹燃放时间禁青岛人春节期间限放烟花爆竹燃放时间禁春节小时
2019-02-02 12:41,青岛地铁快来扫福我们的福到了你的呢快来扫福我们的福到了你的呢快来扫福我们的福到了你的呢
2019-02-02 12:41,青岛地铁话筒话筒话筒话筒话筒话筒话筒话筒春节假期出行攻略来啦行车间隔有调整春节假期出行攻略来啦行车间隔有调整春节假期出行攻略来啦行车间隔有调整
2019-02-01 19:11,青岛地铁携带这些物品是不能乘地铁的你知道吗携带这些物品是不能乘地铁的你知道吗携带这些物品是不能乘地铁的你知道吗
2019-02-01 19:08,青岛地铁最新进展地铁号线沂水路站站厅层贯通最新进展地铁号线沂水路站站厅层贯通最新进展地铁号线沂水路站站厅层贯通
2019-01-31 18:59,#春节168小时#,青岛地铁话筒话筒过年了年集赶起来执法人员带您了解禁带限带物品了过年了年集赶起来执法人员带您了解禁带限过年了年集赶起来执法人员带您了解禁带限春节小时
2019-01-30 17:49,#春节168小时#,青岛地铁话筒话筒助力春运温暖回家助力春运温暖回家助力春运温暖回家春节小时
2019-01-30 08:46,青岛地铁分享图片
2019-01-30 07:49,#春节168小时#,嘻嘻嘻嘻嘻嘻嘻嘻笑而不语笑而不语笑而不语笑而不语
2019-01-29 20:18,青岛地铁观青岛地铁四线全景晓青岛人文地理情怀快来看地铁车站全景观青岛地铁四线全景晓青岛人文地理情怀快观青岛地铁四线全景晓青岛人文地理情怀快
2019-01-29 07:36,#春节168小时#,青岛地铁畅达青岛地铁幸福伴你出行青岛地铁全力做好年春运服务保障工作畅达青岛地铁幸福伴你出行青岛地铁全力做畅达青岛地铁幸福伴你出行青岛地铁全力做春节小时
2019-01-29 07:34,青岛地铁地铁号线开通满月引领西海岸新区新发展地铁号线开通满月引领西海岸新区新发展地铁号线开通满月引领西海岸新区新发展
2019-01-29 07:33,青岛地铁一张图看懂地铁年会知多少
2019-01-28 16:30,#助力春运#,青岛地铁助力春运春节小时春运期间回家过年的朋友大多会为行李多又重大包小包提不动的情况发愁青岛地铁在铁路换乘站青岛站青岛北站地铁站以及靠近汽车站的辽阳东路地铁站推出助力春运服务举措携带大件行李行动不便的乘客可以联系车站工作人员车站会安排员工使用爱心小推车帮展开全文
2019-01-28 06:58,青岛地铁小年快乐心心
2019-01-28 06:54,青岛地铁服务品牌车站之青春车站五四广场站服务品牌车站之青春车站五四广场站服务品牌车站之青春车站五四广场站
2019-01-26 18:10,青岛地铁青岛地铁年运行分析报告发青岛地铁年运行分析报告发布青岛地铁年运行分析报告发布
2019-01-25 08:05,青岛地铁再出发
2019-01-24 19:04,青岛地铁三个关键词勾勒青岛地铁新年蓝图三个关键词勾勒青岛地铁新年蓝图三个关键词勾勒青岛地铁新年蓝图
2019-01-23 21:13,青岛地铁号线青岛北站方向列车因设备故障在敦化路站清客后退出服务需要退票的乘客可在日内就近到任一地铁站客服中心进行办理有其他疑问的乘客可拨打进行咨询目前已解决故障问题运营秩序已经恢复对于给您带来的不便敬请谅解感谢您对青岛地铁的关注
2019-01-23 16:34,青岛地铁话筒话筒
2019-01-22 15:58,青岛地铁米奇比心米奇比心米奇比心米奇比心
2019-01-22 09:20,青岛地铁心心
2019-01-21 21:19,青岛地铁地铁春运小贴士温暖您的回家路地铁春运小贴士温暖您的回家路地铁春运小贴士温暖您的回家路
2019-01-20 09:54,青岛地铁青岛地铁拉开春运帷幕青岛地铁拉开春运帷幕青岛地铁拉开春运帷幕
2019-01-19 13:55,青岛地铁分分钟带你了解地铁大小交路运行分分钟带你了解地铁大小交路运行分分钟带你了解地铁大小交路运行
2019-01-18 20:28,青岛地铁自动驾驶助力绿色出行自动驾驶助力绿色出行自动驾驶助力绿色出行
2019-01-17 20:03,青岛地铁话筒话筒爱心共享站试点您需要的充电宝雨伞纸巾全都有救命神器这里也有话筒话筒爱心共享站试点您需要的充电宝雨伞纸爱心共享站试点您需要的充电宝雨伞纸
2019-01-17 20:02,青岛地铁耶耶非常满意青岛地铁年乘客满意度调查结果公布非常满意青岛地铁年乘客满意度调查结果非常满意青岛地铁年乘客满意度调查结果
2019-01-16 21:30,#氢弹之父于敏逝世#,心心
2019-01-15 17:52,青岛地铁去市图书馆能看地铁晨报啦挤眼挤眼心心兹收到青岛地铁文化传媒有限公司捐赠的青岛地铁晨报合订本共册所捐图书丰富了我馆馆藏为读者提供了宝贵的知识信息上周五本报负责人从青岛市图书馆副馆长宋跃手中接过了收藏证书青岛地铁文化传媒有限公司值成立三周年之际向青岛市图书馆捐赠展开全文
2019-01-14 19:53,青岛地铁笑而不语笑而不语柠檬黄亮相地铁号线首列车开始调试耶耶青岛地铁号线首列车已组装完成目前正在进行场段内试验以及公里稳定运行测试号线初期配备列车车辆采用型电客车总长米最大宽度米最大高度米车厢编组配备个座位最大载客量约人由中车青岛四方机展开全文
2019-01-14 17:43,青岛地铁萌宠与萌宝合影评选开始啦参与投票赢青岛地铁吉祥物首发公仔萌宠与萌宝合影评选开始啦参与投票赢萌宠与萌宝合影评选开始啦参与投票赢
2019-01-14 17:41,青岛地铁青岛地铁纪念生肖票猪年限定限量套抢青岛地铁纪念生肖票猪年限定限量青岛地铁纪念生肖票猪年限定限量
2019-01-13 13:46,青岛地铁喜报青岛地铁金融控股有限公司荣获青岛市金融创新奖喜报青岛地铁金融控股有限公司荣获青岛市金喜报青岛地铁金融控股有限公司荣获青岛市金
2019-01-12 10:59,青岛地铁地铁是如何规划的地铁是如何规划的地铁是如何规划的
2019-01-11 18:27,青岛地铁地铁火灾疏散逃生知识你知道吗地铁火灾疏散逃生知识你知道吗地铁火灾疏散逃生知识你知道吗
2019-01-11 18:26,青岛地铁安全乘直梯文明享便利安全乘直梯文明享便利安全乘直梯文明享便利
2019-01-11 15:05,#暖视频#,
2019-01-10 21:17,青岛地铁新起点新征程心服务馨体验号线打造三米有真情特色服务新起点新征程心服务馨体验号线打造三米新起点新征程心服务馨体验号线打造三米
2019-01-10 10:47,青岛地铁喜讯地铁号线首个换乘站站厅层贯通喜讯地铁号线首个换乘站站厅层贯通喜讯地铁号线首个换乘站站厅层贯通
2019-01-09 16:55,#2018山东政务V影响力峰会#,比心继续努力米奇比心米奇比心
2019-01-08 13:31,二木一直在努力丶谢谢青岛地铁站的工作人员青岛地铁青岛地铁我遗失了身份证由于不知道丢失在哪里心急如焚我是在青岛读书的一个普通大学生老家并不是青岛的没有身份证回家都难而且马上就要期末考试及时补办也会很麻烦昨天我妈给我打电话说身份证找到了丢在地铁上了有人捡到给了地铁站并展开全文
2019-01-08 17:47,青岛地铁地铁号线你值得了解的件小事地铁号线你值得了解的件小事地铁号线你值得了解的件小事
2019-01-07 19:00,青岛地铁话筒话筒新增个工作面地铁号线海底隧道施工大提速话筒话筒为加快号线施工进度青岛地铁在号线海底隧道增加工作面使用新增开挖一条隧道为海底隧道施工增加了个工作面极大提高了施工速度号线过海段全长其中海域段长度为号线关键控制性工程工期紧任务重展开全文
2019-01-07 18:58,青岛地铁青岛地铁获称山东省服务名牌荣誉称号青岛地铁获称山东省服务名青岛地铁获称山东省服务名
2019-01-06 10:54,路线在此笑而不语笑而不语查看图片
2019-01-06 10:51,青岛地铁萌宝巡游开始啦你碰见了吗笑而不语笑而不语
2019-01-05 08:39,小寒了今天冷吗思考思考
2019-01-04 19:47,青岛地铁爱你爱你你好请问有什么可以帮您你好请问有什么可以帮您你好请问有什么可以帮您
2019-01-04 19:46,青岛地铁话筒话筒话筒话筒米奇比心米奇比心米奇比心米奇比心地铁传媒三周年庆够时尚能减压有萌宠本周日有场邂逅等着你地铁传媒三周年庆够时尚能减压有萌宠地铁传媒三周年庆够时尚能减压有萌宠
2019-01-02 14:10,#2018山东政务V影响力峰会#,青岛地铁山东政务影响力峰会我来了心心积微成著聚力凝心加油加油我是青岛地铁青岛地铁月日我在山东政务影响力峰会与你共同回顾政务微博这一年致敬影响力新浪山东头条新浪山东头条
2019-01-01 08:05,青岛地铁祝大家年顺顺利利
2019-01-01 08:04,青岛地铁青岛地铁再见你好青岛地铁再见你好青岛地铁再见你好
2018-12-30 22:31,青岛地铁位地铁垦荒人为畅行我们时刻准备着位地铁垦荒人为畅行我们时刻准备着位地铁垦荒人为畅行我们时刻准备着
2018-12-30 22:29,青岛地铁话筒话筒话筒话筒元旦小长假出行提醒元旦小长假出行提醒元旦小长假出行提醒
2018-12-29 05:44,青岛地铁地铁号线大洋站封顶话筒话筒加油加油年月日青岛地铁号线大洋站车站封顶大洋站是地铁号线过海后的第一个车站位于青岛市红岛经济区为地下两层岛式车站总长车站宽深度采用明挖顺作法施工作为青岛地铁号线过海第一站青岛地铁号线铺轨基地之一承担着过海展开全文
2018-12-28 09:47,青岛地铁国内首例青岛地铁实现移动电视与手机同步直播国内首例青岛地铁实现移动电视与手机同步直播国内首例青岛地铁实现移动电视与手机同步直播
2018-12-28 09:47,青岛地铁没想到在地铁列车上穿越四季赏美景号线主题车惊艳亮相没想到在地铁列车上穿越四季赏美景号线没想到在地铁列车上穿越四季赏美景号线
2018-12-27 08:45,青岛地铁号线的时刻表更新到置顶了各位小伙伴们可以查询啦
2018-12-27 07:41,青岛地铁喜大普奔地铁号线昨日通车西海岸进入地铁时代喜大普奔地铁号线今日通车西海岸进入地喜大普奔地铁号线今日通车西海岸进入地
2018-12-26 11:11,青岛地铁笑而不语笑而不语同步有木有
2018-12-26 10:32,青岛地铁米奇比心米奇比心点开始直播地铁电视同步哦
2018-12-26 10:18,青岛地铁圣诞老人圣诞老人号线的主题车西海岸号你坐上了吗
2018-12-26 07:39,青岛地铁耶耶耶耶
