2014-04-04 17:16,青岛地铁为科学预测青岛地铁号线的客流量同时按照青岛市物价局关于地铁票价制定程序的要求青岛地铁集团委托青岛理工大学将于年月至月期间对青岛地铁号线周边区域进行交通调查调查员将持工作证进行当面访问如对调查人员身份有疑问可咨询刘女士潘教授
2014-03-24 14:40,青岛地铁月日青岛地铁指挥部办公室在市妇女儿童活动中心举办岛城新成员我与地铁共成长青岛地铁科普知识进校园活动专场讲座来自地铁一线的授课老师通过学生们燃放的鞭炮和礼花入手过渡到地铁爆破施工进而讲解爆破施工的科学知识让学生们了解青岛地层的特性和体会地铁施建设者的辛苦
2014-03-14 09:41,青岛地铁月日上午由青岛地铁集团有限公司党委书记李建国带队组织地铁集团名志愿者前往平度市大沽河河滩义务植树植树活动既是一种义务更是一种责任大家应当积极行动起来为绿化家园尽一份力让我们生存的这片土地更绿更美
2014-03-12 16:37,#治霾-抑扬尘#,必须的
2014-03-12 10:21,青岛地铁月日上午青岛地铁邀请中国安全生产科学研究院原院长研究员博士生导师刘铁民教授就企业安全生产主体责任及风险应急管理进行专题讲座刘教授通过国内许多重特大事故案例提出了从传统安全管理向现代风险管理转变的理念以及企业要采用系统安全管理方式坚持以人为本方能实现安全发展
2014-03-07 14:43,青岛地铁青岛市地铁号线一期工程车站站名自年月日起开始为期个工作日的向社会公开征求意见市民可通过邮寄和电子邮件两种方式进行反馈详情可登陆青岛地铁官方网站网页链接网页链接查看
2014-02-27 10:38,#猜一猜#,青岛印象青岛印象青岛故事广播青岛故事广播早报客爱家早报客爱家恋青岛恋青岛青岛微生活青岛微生活青岛新闻广播青岛新闻广播青岛音乐体育广播青岛音乐体育广播青岛城乡建设青岛城乡建设青岛地铁青岛地铁
2014-02-25 01:01,青岛地铁青岛市轨道交通建设管理办法将于年月日起施行这是我市首部全方位规范轨道交通建设的政府规章办法重在规范建设行为最大限度地把地铁建设对周边居民住宅商户经营以及道路交通的影响降至最低设置控制保护区保护各项地铁设施安全以保证未来乘坐安全协调各方充分保障公共利益
2014-01-31 01:14,青岛地铁向一线建设者致敬感谢各界给予我们的支持青岛地铁给大家拜年了
2014-01-23 16:11,青岛地铁日前青岛地铁建设指挥部青岛地铁集团召开地铁艺术设计专家咨询会青岛地铁艺术设计专家委员会主任委员清华大学美术学院教授国家画院公共艺术院执行院长著名画家杜大恺山东省文联主席山东工艺美术院院长第条长围脖长围脖
2014-01-23 00:34,青岛地铁月日上午包括中国书法家协会会员刘健赵善亭田文玲张紫溪张颖苗久永王立群王建中等十名知名书法名家青岛妇女儿童活动中心副主任乔红及少儿书法组的小学员们一行二十余人来到地铁建设一线为建设者书写春联和福字身处一线的地铁建设者们深刻感受到社会各界的支持与关爱
2014-01-18 00:46,青岛地铁月日点青岛地铁号线一期环城南路站至区间东韩站环城南路站区间竖井双线顺利贯通标志着环城南路站及区间土建主体工程已经取得阶段性胜利这也是青岛地铁二号线首个实现双线贯通的区段下一步施工单位将继续向东韩站方向掘进争取早日实现整个区间贯通
2014-01-17 14:38,地铁是个大工程
2014-01-16 18:12,青岛地铁号线南京路站周五晚起调流青岛地铁号线一期工程南京路站位于香港中路南京路交汇口车站施工占用香港路车行道围挡宽度米长度米计划于年月日晚开始调流青岛地铁提醒广使用长围脖长围脖分享
2014-01-16 18:08,青岛地铁青岛地铁号线一期工程南京路站计划于年月日晚开始调流青岛地铁提醒广大市民按照调流标志标线通行因施工对交通带来的不便市地铁指挥部地铁集团请全体市民多多谅解市地铁指挥部地铁集团及全体地铁参建者向岛城市民致以衷心的谢意并恳请大家一如既往的支持我市地铁建设事业
2014-01-09 10:01,青岛地铁五四广场站香港中路不直的情况说明五四广场站于年月日完成了三期调流山东路以西恢复香港中路双向车道山东路以东恢复调流路米宽原调流路继续详见长微博分享自长微博工具长微博工具网页链接网页链接
2014-01-09 10:01,青岛地铁五四广场站香港中路不直的情况说明五四广场站于年月日完成了三期调流山东路以西恢复香港中路双向车道山东路以东恢复调流路米宽原调流路继续详见长微博分享自长微博工具长微博工具网页链接网页链接
2013-12-30 17:17,青岛地铁月日晚由中铁二十局集团承建的青岛地铁号线五四广场车站将完成三期调流恢复香港中路和山东路双向八车道通行行道两侧设人行道宽度不少于米调流得到市建委和市市政管理处市公安局交警支队市南大队香港中路中队青岛市政设计院及公交集团等单位大力支持
2013-12-29 13:34,青岛地铁月日青岛地铁五四广场车站江西路车站区间隧道左线大里程贯通工程独头掘进米是号线单洞独头掘进最长的隧道隧道下穿公共资源交易大厅等座密集建筑物共米穿越地层多为强中风化花岗岩中风化煌斑岩岩体较破碎裂隙水极为丰富青岛地铁由衷感谢周边居民与单位的大力支持
2013-12-25 18:07,青岛地铁地铁出入口无顶盖设计充分考虑防水无顶盖设计三防倒灌设计人员表示出入口无顶盖设计并非青岛独有也是世界地铁出入口的一种主要方式无顶盖主要是考虑部分出入口距周边详见长微博分享自长微博工具长微博工具网页链接网页链接
2013-12-25 18:07,青岛地铁地铁出入口无顶盖设计充分考虑防水无顶盖设计三防倒灌设计人员表示出入口无顶盖设计并非青岛独有也是世界地铁出入口的一种主要方式无顶盖主要是考虑部分出入口距周边详见长微博分享自长微博工具长微博工具网页链接网页链接
2013-12-25 11:03,青岛地铁随着青岛地铁号线振华路车站永平路车站先后转入附属结构施工在周边商户和居民以及相关部门的大力配合下月日起位于李沧区的振华路恢复双向四车道通车另据了解包括山东路等地铁施工调流路近期也将陆续完成管线回迁信号设施恢复等相关施工并恢复通车
2013-12-25 09:54,青岛地铁号线车站出入口及车站装修设计相关设计方案于月日月日在青岛市博物馆进行社会公开展示青岛地铁邀请广大市民提出宝贵建议并将根据市民意见及建议对方案进行调整优化市民可通过公开展示现场填写调查问卷或者通过电子邮件反馈意见及建议
2013-12-13 22:56,青岛地铁经由国务院同意月日国家发改委印发了关于青岛市城市轨道交通近期建设规划年的通知发改基础号批复了地铁号线工程号线工程号线一期工程等个项目全长约公里为地铁号线下一步可研报告编制可研审批以及初步设计等工作奠定了基础
2013-12-13 16:31,孙不错真不错突然想到今天上午青岛地铁的老师来我们学校讲座交流更加期待一年半以后自己的工作了就首先做好现在畅想一下未来给自己加把劲兔子兔子青岛地铁青岛地铁青岛地铁官方微博青岛地铁官方微博
2013-11-28 15:49,青岛地铁大家可以先看看去外地乘地铁也得注意关于天津地铁运营天津地铁运营的投票乘地铁讲文明重安全这些陋习不能有调查挺赞的先转给你们大家帮我投一票吧网页链接网页链接
2013-11-23 15:41,青岛地铁今天下午地铁集体的百余名员工组织起来为黄岛输油管线爆炸事故中受伤的人员无偿献血市中心血站派出辆集中采血车
2013-11-22 18:17,青岛交通广播青岛交通广播今天注定是一个悲伤的日子个鲜活的生命突然逝去泪泪泪泪今夜难眠一起祈祷平安祈祷青岛不再有这样的伤痛永远美丽安详蜡烛蜡烛蜡烛蜡烛蜡烛蜡烛
2013-11-22 09:54,转发微博
2013-11-21 08:32,青岛广播新媒体青岛广播新媒体青岛新闻广播青岛新闻广播王总经理解说蓝图青岛轨道交通总规划条线路条地下线条地上线和号线经国家批准在建中蓝色硅谷董家口胶州新机场的三线是近期的筹划中其余的线依据城市的发展符合实际情况陆续展开预计年时间周期
2013-11-20 23:11,#地铁快讯#,播报好迅速
2013-11-12 22:55,青岛地铁月日号线出入段线最后一块顶板顺利浇筑出入段线隧道顺利贯通号线出入段线工程是连接火车北站和号线车辆段的明挖区间隧道由宏润建设集团股份有限公司承建参建单位在国内首次成功的在生活垃圾杂填土层中实施高压旋喷止水帷幕施工号线出入段线结构封顶为号线铺轨施工奠定了基础
2013-11-06 11:11,青岛地铁民生微博方便你我青岛民生政务微博群青岛民生政务微博群集区市和市直部门官微于一体为您与政府部门互动交流提供便捷渠道移动用户可在安卓市场苹果商店等下载客户端名称青岛民生微博网页链接网页链接
2013-11-01 18:44,青岛地铁月日地铁火车北站站主体结构工程顺利封顶在此期间各参建单位一起克服了海边滩涂区多年垃圾填埋场内复杂大型深基坑开挖中富水软弱多种支撑支护方式组合应用及支撑转换等技术难题克服了交叉作业干扰大工序转换频繁物流运输任务重环保要求高资源投入集中的困难
2013-10-30 15:17,感谢为畅通青岛未来而付出的人们
2013-10-29 17:12,赞青岛交警青岛交警
2013-10-19 14:50,青岛地铁我市地铁号线一期工程发布了香港路沿线南京路站等五处地铁站点交通调流方案在调流前期准备工作期间市地铁指挥部克服重重困难积极与我市相关部门和单位密切配合通力协作多次调整调流方案以确保此次调流顺利进行具体调流信息见网页链接网页链接
2013-10-17 21:53,#记忆#,美化历史的人也是选择性遗忘青岛印象青岛印象这个村落大家很熟悉就是现在的青岛吴家村饥饿的时代过去了国家正在走向富强稳定是压倒一切的裸枪裸枪幸好那个时代过去了提刀探花提刀探花难受
2013-10-15 15:10,青岛地铁月日年度青岛地铁文化进工地进社区系列活动启动本年度文化进工地进社区系列活动共分为流动图书室文艺演出流动电影院三大版块为更贴近地铁建设者的工作和生活在图书类型设置上地铁集团专门购置了一批地铁建设的专业书籍以满足地铁建设者的业务需求
2013-10-08 16:51,青岛地铁特别提示近期有部分机构以地铁培训就业名义收取费用在此青岛地铁强调引进人才不收取任何费用请注意鉴别真伪
2013-09-30 17:58,青岛地铁青岛地铁号线首列地铁车辆月日在南车青岛四方竣工下线车辆秉承安全可靠先进成熟设计理念最高运营速度为公里小时采用辆编组形式最大载客量为人车辆还实现了三项首次制动系统首次采用无油空气压缩机水性油漆酚醛玻璃钢等环保新材料也是在国内地铁车辆中首次采用
2013-09-30 17:48,青岛地铁青岛地铁号线首列地铁车辆月日在南车青岛四方竣工下线车辆秉承安全可靠先进成熟设计理念最高运营速度为公里小时采用辆编组形式最大载客量为人车辆还实现了三项首次制动系统首次采用无油空气压缩机水性油漆酚醛玻璃钢等环保新材料也是在国内地铁车辆中首次采用
2013-09-30 13:50,青岛地铁青岛地铁集团运营分公司年社会招聘公告已经发布欢迎各路英杰投身青岛地铁发展具体职位及条件要求猛戳以下网址地铁官网网页链接网页链接
2013-09-25 10:29,祝贺
2013-09-25 09:20,#波螺女孩的最新消息#,城市保护需要更多年轻人参与他们是城市未来的主人
2013-09-18 11:00,回复地铁族青岛版地铁族青岛版感动感恩感谢今年中秋你在哪儿没有你的全家福高清网页链接网页链接地铁族青岛版地铁族青岛版向地铁建设者致敬
2013-09-18 00:52,青岛地铁致全体青岛地铁建设者的一封信亲爱的青岛地铁建设者们秋风送爽丹桂飘香中秋已至国庆在望值此佳节即将到来之际青岛地铁集团以及多万岛城市民详见长微博分享自长微博工具长微博工具网页链接网页链接
2013-09-18 00:47,青岛地铁年月日青岛市地铁工程建设指挥部办公室青岛地铁集团在地铁号线中铁十二局项目部举办了青岛地铁中秋佳节团圆同乐会为节假日仍然坚守一线的地铁建设者们送去了中秋问候和祝福表达感谢之情同乐会现场布置简约温馨参与表演的人员均为地铁建设者现场互动环节发放的纪念品简朴实用
2013-09-17 17:33,关注
2013-09-11 12:22,回复新浪山东头条新浪山东头条关注新浪山东头条新浪山东头条话筒话筒青岛临沂火车票寻失主今早路公交车驾驶员捡到两张火车票为明天早上青岛到临沂的火车票上的姓名分别是王勤胜于晓联系人张女士青岛公安青岛公安青岛交警青岛交警青岛发布青岛发布青岛地铁青岛地铁胶东县令胶东县令青岛晚报刘卓毅青岛晚报刘卓毅青岛某姑娘青岛某姑娘
2013-09-06 10:19,青岛地铁近期有人打着青岛地铁委培招生的旗号进行招生宣传青岛地铁郑重声明青岛地铁年委培招生工作已经结束详见长微博分享自长微博工具长微博工具网页链接网页链接
2013-09-04 09:46,#波螺女孩#,一个人的成熟一座城市的成长
2013-09-01 01:12,青岛地铁月日青岛地铁产业协会成立余家地铁相关企业参会协会成立后将通过形成企业间的联合优势加强龙头企业和配套企业间的资源共享促进青岛地铁产业经济健康快速发展共创地铁产业的品牌效益为打造青岛千亿级地铁产业链做出积极贡献我在同乐三路同乐三路
2013-08-28 16:17,#万科城市话剧季#,青岛人为了成为幸福宜居城市而活着
2013-08-27 14:14,#寻找“波螺”女孩#,难忘城市记忆惟有影像永存平老虎平老虎转发
2013-08-26 13:32,#交流#,青岛需要对自己城市发展的不断思考
2013-08-20 09:49,青岛地铁青岛地铁号线是全市第一条跨海的轨道交通线路起至黄岛峨眉山路与长江路交叉口沿长江中路滨海大道漓江路薛家岛团岛青岛火车站中山路胶州路延安路台东威海路人民路四流路火车北站重庆路流亭机场凤岗路中城路到终点东郭庄站共设车站座
2013-08-20 09:47,青岛地铁预评估会议后青岛地铁号线可研报告将进行修改完善待国家正式批复第二轮建设规划市发改委批复地铁号线可研报告后青岛地铁号线就将进入设计施工阶段青岛地铁号线是贯穿青岛南北连接东西两岸的骨干线路对缓解城市南北交通压力促进城市结构调整具有重要意义
2013-08-20 09:43,青岛地铁日前人组成的专家组参与了青岛地铁号线工程可行性研究报告预评估会专家组审阅了可研报告及有关文件和材料听取全面汇报实地踏勘了线路专家组认为可研报告内容全面数据翔实采用的主要技术标准基本合理技术方案基本可行基本达到了可研报告的深度要求
2013-08-15 16:33,青岛地铁探访父母地下建设工地乘坐大鼻子校车与家长同游海洋世界博物馆青岛地铁于月日举行情满地铁一线关爱候鸟儿童暑期亲子活动参加本次活动的名候鸟儿童全部为青岛地铁一线建设者子女年龄为岁最让孩子快乐的是他们与平时工作繁忙的家长一起度过了欢乐的一天
2013-08-11 01:54,青岛地铁月日青岛市地铁工程建设指挥部青岛地铁集团有限公司召开党的群众路线教育实践活动动员会青岛地铁要在真字上下功夫真学真查真治真干真转真改真正做到教育实践活动与推进集团各项事业两不误两促进务求党的群众路线教育实践活动取得实效
2013-08-08 12:03,青岛地铁青岛地铁号线施工现场钢筋工们手持喷出上千度高温的电焊进行焊接一人一天平均要用掉上百根焊条正在施工的钢筋工们却穿着长袖长裤和安全帽脚上穿着密不透气的高筒防护鞋双手戴着厚厚的防护手套大滴汗珠从操作工的脸上掉落下来
2013-08-07 10:28,青岛地铁青岛地铁官网上线了网页链接网页链接威武威武
2013-08-02 15:42,地铁工人赞一个
2013-08-02 15:12,青岛地铁月日青岛地铁集团总工程师迟建平一行来到市交警支队慰问进入夏季以来温度不断攀升在酷暑中我市交警在一线坚岗位以极大的毅力将受了高温和烈日的考验我市交通顺畅做出了杰出贡献青岛地铁集团为我市交警送去崂山矿泉水表达对交警队伍在酷暑中坚持工作的敬意并表示慰问
2013-08-02 10:04,青岛地铁艺术设计专家委员会由著名画家清华大学美术学院教授杜大恺山东省文联主席潘鲁生清华大学美术学院教授何洁中央美术学院城市设计学院副院长王中华东建筑设计院总建筑师方旦青岛市历史学会副会长于佐臣青岛市民俗文化学者李明青岛市美术馆馆长郝麒山东工艺美院副院长苗登宇组成
2013-08-02 09:05,青岛地铁月日青岛地铁艺术设计专家委员会成立大会举行会议通过了青岛地铁艺术设计专家委员会章程和青岛地铁艺术设计专家委员会名单并向专家代表颁发聘书青岛地铁将结合青岛文化特色和地域环境特点将对车站站内空间进行艺术设计以一线一主题一站一故事为目标
2013-07-30 17:34,出行文明现在开始城阳交通运输城阳交通运输咱岛城也快有地铁了提前学习养成文明的乘车习惯呵呵
2013-07-26 08:58,青岛地铁月日由青岛市地铁工程建设指挥部办公室青岛地铁集团海军海上防险救生支队主办的的军地文艺汇演在青岛港三号码头礼堂举办节目全部由青岛地铁一线建设者海军海上防险救生支队的官兵组织编排并表演既体现了军旅生活也展现了地铁建设情况演出中还有不少官兵与地铁建设者合作的环节
2013-07-25 09:21,关于乘车礼仪我们还需要一段时间培养相信我们的城市文明程度会越来越高
2013-07-20 21:18,感谢每一位市民以及关心青岛地铁的朋友有了你们我们的努力才有意义谢谢没头脑先僧没头脑先僧青岛地铁青岛地铁
2013-07-15 11:54,谣言不要传播了
2013-07-15 10:58,请拨打青岛地铁定向委培生咨询热线巩观镧的爱巩观镧的爱转发微博
2013-07-11 18:40,青岛地铁年月日下午点分左右青岛地铁号线标保儿站龙门吊倾倒造成辆停放车辆受损现场无人员伤亡具体事故原因正在调查过程中事故发生后地铁集团立即通知青岛地铁号线在建工程所有机械设备停止作业组织人员对龙门吊等各种机械设备进行安全排查消除事故隐患
2013-07-11 09:51,青岛地铁青岛地铁网络中规模最大换乘地铁线路最多换乘交通方式最多的车站地铁青岛北站施工进入尾声目前已经完成工程总量的车站公共区域主体已经完工并交付给铁路青岛北客站方面建设和施工
2013-07-10 10:47,请拨打青岛地铁定向委培生咨询热线
2013-07-08 13:09,呵呵半岛网青岛新闻网首页都有链接自己戳吧半岛铁盒半岛铁盒这么多人给我留个位置呀
2013-07-08 11:17,网页链接网页链接具体信息这有半岛铁盒半岛铁盒这么多人给我留个位置呀
2013-07-08 09:42,青岛地铁月日日多名应届高中毕业生参与了举行的年青岛地铁定向委培招生首批面试首批报名者已经接受面试面试合格的学生下一步学校将进入体检程序这些定向委培生未来学习结束考试合格将主要到青岛地铁号线号线的运营服务和技术岗位就业这也是青岛地铁线路运营人员的重要来源
2013-07-08 00:46,青岛地铁年青岛地铁定向委培招生运营技术管理人员名包括车辆驾驶信号维护供电维护运营管理车辆检修机电一体化工建通信维护等个专业定向委培生学习结束考试合格将主要到青岛地铁号线号线的运营服务和技术岗位就业目前招生还在进行中网页链接网页链接
2013-07-04 23:25,请大家留意青岛交通广播青岛交通广播青岛公安青岛公安
2013-07-04 09:06,#有礼转发#,美丽青岛青岛印象青岛印象莱阳路的海莱阳路的海鱼的杀手鱼的杀手美美美美美美子美美美美美美子英南同学英南同学青岛地铁青岛地铁
2013-07-03 11:10,#成都地铁极品女#,天气燥热大家更要平心静气青岛人也要自我提醒了
2013-07-01 17:11,青岛一梦青岛一梦青岛邱磊青岛邱磊青岛交通广播青岛交通广播青岛早报青岛早报半岛都市报半岛都市报青岛地铁青岛地铁青岛交警青岛交警
2013-07-01 09:36,青岛地铁成都的郭明和刘萌想在月日举办一场特殊的婚礼把地铁当迎亲婚车可期盼的温馨浪漫镜头里却满是地铁工作人员的阻拦争执和遮挡地铁方也很无奈称劝阻是为维护正常秩序你支持哪一边
2013-06-26 10:37,青岛地铁今天上午余名青岛地铁一线建设者在地铁号线太平角车站举行了入党宣誓仪式来自社区的名老党员见证了新党员入党一刻并重温入党誓词
2013-06-25 14:45,威武威武
2013-06-20 20:36,#资讯#,青岛晚报青岛晚报资讯青岛印象艺术青岛当代艺术展将于月日在百丽广场揭幕
2013-06-20 17:15,转发微博
2013-06-20 16:56,青岛地铁近日青岛地铁号线保儿站主体结构顺利完工青岛地铁号线土建标保儿全长米位于青岛市市北区黑龙江路与长沙路交叉路口西南角采用明挖法施工车站分为两层三跨无柱拱形结构及两层两跨三种结构体系其中无柱拱形结构净跨达米为国内地铁施工首创明挖无柱拱形地铁车站
2013-06-19 08:15,青岛地铁太阳你终于回来了祝大家一天顺利
2013-06-08 23:50,有人见过吗
2013-06-08 23:46,请大家帮着看看牙牙疼牙牙疼恳求大家的帮助谢谢青岛公安青岛公安青岛公安青岛公安青岛地铁青岛地铁青岛火车站青岛火车站青岛交通广播青岛交通广播青岛新闻广播青岛新闻广播青岛新闻网青岛新闻网青岛早报青岛早报青岛晚报青岛晚报
2013-06-06 15:28,这本书将一个个温暖感动真情实意鲜活灵现的地铁故事展示出来是一部普通人自己写就的关于城市梦想生活梦想的书另据了解本书销售所得将全部捐给贫困地区希望小学用于购买图书
2013-06-06 15:25,青岛地铁月日开往幸福的地铁新书首发式暨地铁故事全国征文活动颁奖会在书城一楼大厅举办来自市委宣传部市地铁工程建设指挥部市文广新局市文联等有关部门的领导和部分获奖作者等余人出席了首发式据了解此项活动已经纳入青岛市全民读书季活动内容
2013-06-05 16:12,青岛地铁月日至日国家住建部组织召开了青岛市城市轨道交通近期建设规划年年专家审查会此次专家审查是国务院批复青岛市城市轨道交通近期建设规划年年审查必备程序为国务院批准我市青岛市城市轨道交通近期建设规划年年奠定了重要基础
2013-06-05 13:23,青岛地铁近日网上流传的青岛地铁车辆谍照经了解只是备选方案之一并非最后方案
2013-06-05 07:30,地铁建设者来自全国各地对他们来说青岛也是另一种意义上的故乡青岛邱磊青岛邱磊今天参与吧中铁四局青岛地铁汽车东站项目部中铁四局青岛地铁汽车东站项目部开往幸福的地铁参加地铁建设也是一种幸福中铁四局青年愿为青岛地铁奉献青春
2013-06-04 16:41,青岛地铁月日青岛地铁集团主办的地铁故事征文大赛优秀作品结集而成开往幸福的地铁将在青岛书城举办首发明天交通热线年轻的征文获奖作者和邱磊老师将聊聊关于地铁的故事关于乘坐地铁人的那些事以及由此引申出的文明交通文明出行话题青岛邱磊青岛邱磊
2013-05-28 10:35,青岛地铁月日在六一儿童节来临之际青岛地铁集团特意邀请来自桦川路小学及其他小学的名小学生代表走进青岛地铁号线太平角公园站的施工现场了解地铁建设进程畅想地铁生活参观结束后孩子们兴奋地交流着自己的感受想象着未来地铁通车后的情景对他们来说这个六一儿童节过得特别有意义
2013-05-28 10:01,地铁大家庭齐庆贺
2013-05-23 16:41,青岛地铁青岛地铁号线暗挖区间隧道设计长度千米目前累计完成开挖千米完成设计量的累计完成二衬千米完成设计量的除了个暗挖区间外其余个暗挖区间陆续进入二衬作为铺轨前的重要工序二衬对于未来地铁通行安全有着重要意义
